ano;mes;processo_numero;solicitacao_data;solicitacao_hora;solicitacao_descricao;solicitacao_regional;solicitacao_bairro;solicitacao_localidade;solicitacao_endereco;solicitacao_roteiro;rpa_codigo;rpa_nome;solicitacao_microrregiao;solicitacao_plantao;processo_situacao;processo_tipo;processo_origem;processo_solicitacao
2012;07-julho;8005258512;2012-07-13;12:15;USUARIO SOLICITA UMA VISTORIA EM MURO DE ARRIMO QUE ESTA COM RISCO.;NORTE;AGUA FRIA;AGUA FRIA;RUA SOLITA N 73;RUA EM FRENTE AO CENTRO DA JUVENTUDE.;Não informada;Não informado;NORTE - 2;Não;completo;ATENDIMENTO;;
2012;07-julho;8005574412;2012-07-27;09:07;USUARIO SOLICITA UMA VISTORIA NA BARREIRA;NORTE;AGUA FRIA;largo da bomba do hemeterio;rua pastor bembi 196;prox a igreja batista;Não informada;Não informado;NORTE - 2;Não;completo;ATENDIMENTO;;
2012;06-junho;8003753912;2012-06-14;11:21;colocação de lona;SUL;ALTO DA BELA VISTA;Alto da Bela vista;Rua candido mendes, numero 121, casa numero 15;Por ras do casarão de pedra;Não informada;Não informado;;Não;execucao;ATENDIMENTO;;
2012;06-junho;8003781212;2012-06-14;12:01;Colocação de lona;SUL;ALTO DA BELA VISTA;Ibura;Rua Itiquira, usuaria nao sabe informar o numero de nenhuma residencia proxima a barreira;Proximo ao casarao de pedra, garagem de aldo;Não informada;Não informado;;Não;execucao;ATENDIMENTO;;
2016;06-junho;8038124016;2016-06-23;13:10;ARVORE DE GRANDE PORTE SITUADA NO TERRENO DA COMPESA, USUARIA RELATA QUE A MESMA ESTÁ APRESENTANDO RACHADURA E TEME DE CAIR SOBRE SEU IMOVEL.;NOROESTE;ALTO DO MANDU;ALTO DO MANDU;RUA TRAMANDAI, N  174;POSTO DE SAÚDE DO ALTO DO MANDU, E RESERVATORIO;3;3-NOROESTE;3.1;Não;execucao;ATENDIMENTO;;Vistoria
2016;06-junho;8034884016;2016-06-10;22:58;USUARIO INFORMA QUE ACABOU DE CAIR UMA PARTE DO REBOCO DA LAJE, QUE JA ESTA COM UMA RACHADURA GRANDE. USUARIO PEDE UMA EQUIPE COM URGENCIA, PARA VISTORIA O IMOVEL, POIS ELA QUER SABER SE HA CONDIÇOES DE PERMANECER NO LOCAL.;NOROESTE;ALTO DO MANDU;ALTO DO MANDU;RUA HUMAITA N 68;PROXIMO AO INSTITUTO RAQUEL DE QUEIROZ;3;3-NOROESTE;3.1;Sim;execucao;ATENDIMENTO;;Vistoria
2016;03-marco;8011328416;2016-03-17;08:38;BARREIRA DE GRANDE PORTE A MESMA ESTÁ OCORRENDO DESLIZAMENTOS PARCIAL, NECESSITA DE VISTORIA E COLOCAÇÃO DE LONA.;NOROESTE;ALTO DO MANDU;ALTO DO MANDU;2 TRV SIRIGI, 65;ESCOLA SÃO MIGUEL;3;3-NOROESTE;3.1;Não;execucao;ATENDIMENTO;;Colocacao de Lonas Plasticas
2016;03-marco;8011328416;2016-03-17;08:38;BARREIRA DE GRANDE PORTE A MESMA ESTÁ OCORRENDO DESLIZAMENTOS PARCIAL, NECESSITA DE VISTORIA E COLOCAÇÃO DE LONA.;NOROESTE;ALTO DO MANDU;ALTO DO MANDU;2 TRV SIRIGI, 65;ESCOLA SÃO MIGUEL;3;3-NOROESTE;3.1;Não;execucao;ATENDIMENTO;;Vistoria
2016;03-marco;8008254316;2016-03-01;10:20;USUÁRIA SOLICITA COLOCAÇÃO DE LONA PLÁSTICA.;NOROESTE;ALTO DO MANDU;ALTO DO MANDU;2 TRV SIRIGI, N 65.;PRÓXIMO A ESCOLA SÃO MIGUEL.;3;3-NOROESTE;3.1;Não;execucao;ATENDIMENTO;;Colocacao de Lonas Plasticas
2016;01-janeiro;8001121816;2016-01-12;12:07;USUARIO INF QUE O TERRNO AO LADO DE SUA CASA ESTA COM MUITO ENTULHO GERANDO RACHADURAS NA RESIDENCIA E QUANDO CHOVE ENTRA LAMA. O MEMSO PEDE URGENCIA;NOROESTE;ALTO DO MANDU;ALTO DO MANDU;RUA   PARAISO DO LESTE, 122;NA SUBIDA DA MAO DE VACA DO BETO;3;3-NOROESTE;3.1;Não;execucao;ATENDIMENTO;;Vistoria
2015;12-dezembro;8039520915;2015-12-28;16:46;MORADOR INFORMA QUE VIZINHO ATEOU FOGO EM LIXOS E MATOS AO LADO DA SUA RESIDENCIA, ATINGINDO A SUA CASA, PROVOCANDO O ESTOURO DO REBOCO, TRANZENDO RISCOS. E ACRESCENTA QUE LAMAS QUE DESCE DA LADEIRA, ESTÁ INVADINDO O SEU TERRENO. PEDE VISTORIAS COM URGENCIA.;NOROESTE;ALTO DO MANDU;ALTO DO MANDU;RUA PARAISO DO LESTE, N 122;POR TRAS DA ESCOLA MAURICIO DE NASSAU. SUBIDA DA MAO DE VACA. PROXIMO A BARRACA DE SEU PEDRO.;3;3-NOROESTE;3.1;Sim;execucao;ATENDIMENTO;;Vistoria
2015;10-outubro;8032123415;2015-10-21;15:12;MORADORA INFORMA QUE A CANALETA ESTÁ COM FISSURAS, DEIXANDO SEU TERRENO ALAGADO E PROVOCANDO INFILTRAÇÕES NA SUA RESIDENCIA. DIZ QUE AS PAREDES DA CAS ESTÃO ATÉ A METADE UMIDAS. PEDE VISTORIA.;NOROESTE;ALTO DO MANDU;ALTO DO MANDU;2 TRV CAMETA, N 331;PROXIMO AO TERMINAL DO ONIBUS ALTO DO MANDU.;3;3-NOROESTE;3.1;Não;execucao;ATENDIMENTO;;Vistoria
2015;09-setembro;8028577415;2015-09-14;09:57;USUÁRIO SOLICITA VISTORIA EM PRÉDIO DE 1 ANDAR, QUE ESTÃO COM OS APARTAMENTOS E A LAJE RACHADAS, E COM PROBLEMAS NA FUNDAÇÃO, A QUAL SE ABRIU UMA CRATERA. URGENTE. POIS O PRÉDIO ESTAR COM RISCOS.;NOROESTE;ALTO DO MANDU;ALTO DO MANDU;RUA MANDACARU, N 331.;EM FRENTE AO INSTITUTO RAQUEL DE QUEIROZ.;3;3-NOROESTE;3.1;Não;execucao;ATENDIMENTO;;Vistoria
2015;08-agosto;8027237515;2015-08-31;11:37;tetetetet;NOROESTE;ALTO DO MANDU;ALTO DO MANDU;tetete;8888888;3;3-NOROESTE;3.1;Não;execucao;ATENDIMENTO;;Vistoria
2015;07-julho;8020397715;2015-07-06;16:32;a usuaria informa que a barreira da rua esta caindo,favor verificar com urgencia.;NOROESTE;ALTO DO MANDU;ALTO DO MANDU;alto do mandu;perto do colegio são miguel e santa pereira.no beco da antena da oi.;3;3-NOROESTE;3.1;Sim;execucao;ATENDIMENTO;;Vistoria
2015;06-junho;8017875915;2015-06-22;19:14;usuário informa que devido a uma infiltração de Compesa esta prejudicando a casa  o mesmo deseja uma vistoria no local para verificar a estrutura do local se realmente esta a perigo.;NOROESTE;ALTO DO MANDU;ALTO DO MANDU;jaguarana n232;prox. ão açude de a pipucos.;3;3-NOROESTE;3.1;Sim;execucao;ATENDIMENTO;;Vistoria
2015;06-junho;8017795515;2015-06-21;06:39;a usuaria informa que no local se encontra um muro com sérios risco de cair a qualquer momento e causar sérios acidentes.favor verificar com urgencia.;NOROESTE;ALTO DO MANDU;ALTO DO MANDU;rua mandacaru;na rua do colegio modelo.;3;3-NOROESTE;3.1;Sim;execucao;ATENDIMENTO;;Vistoria
2015;06-junho;8017065715;2015-06-11;11:15;USUÁRIA INFORMA QUE NA BARREIRA ESTA COM UMA GRANDE INFILTRAÇÃO QUE DEVIDO A ESSE TRANSTORNO ESTA PREJUDICANDO AS RESIDENCIAS DO LOCAL E CAUSANDO RISCO NO LUGAR DE RISCO, A MESMA PEDE URGÊNCIA NA VISTORIA DESTA DEMANDA.;NOROESTE;ALTO DO MANDU;ALTO DO MANDU;RUA SEGUNDA TRV SIRIGI N39;PRÓXIMO A ANTENA DE VESPE E ÃO COLÉGIO FRANÇA PERREIRA.;3;3-NOROESTE;3.1;Não;execucao;ATENDIMENTO;;Vistoria
2015;06-junho;8016711215;2015-06-09;08:30;VISTORIA EM MURO DE UMA RESIDENCIA QUE ESTA COM RISCO DE QUEDA.;NOROESTE;ALTO DO MANDU;ALTO DO MANDU;RUA AMELIOPOLIS Nº63;PROXIMO A MAO DE VACA DO BETO;3;3-NOROESTE;3.1;Não;execucao;ATENDIMENTO;;Vistoria
2015;06-junho;8016499315;2015-06-06;07:17;USUARIA SOLICITA UMA VISTORIA POIS A RESIDENCIA DE SUA VIZINHA O MURO DESABOU DESTRUINDO A CASA DE BAIXO POREM NÃO HOUVE VITIMA;NOROESTE;ALTO DO MANDU;ALTO DO MANDU;RUA PARAISO DO LESTE, SN;AO LADO DA ESCOLA MAURICIO DE NASSAU PRÓXIMO AO NUMERO 73;3;3-NOROESTE;3.1;Sim;execucao;ATENDIMENTO;;Vistoria
2015;06-junho;8016503015;2015-06-06;09:20;USUARIO SOLICITA UMA VISTORIAEM UM MURO COM MAIS DE 10M COM RISCO DE QUEDA E TAMBÉM ESTA APRESENTANDO RACHADURA NO LOCAL;NOROESTE;ALTO DO MANDU;ALTO DO MANDU;RUA PARIASO DO LESTE,102;EM FRENTE A BARRACA DO SENHOR PEDRO E UMA RUA POR TRAS DE IGREJA ASSEMBLEIA DE DEUS;3;3-NOROESTE;3.1;Sim;execucao;ATENDIMENTO;;Vistoria
2015;06-junho;8016501815;2015-06-06;07:33;CAIU UM MURO E ATINGIU UMA PARTE DO TERRAÇO.;NOROESTE;ALTO DO MANDU;ALTO DO MANDU;RUA CURURIPI Nº68;NA RUA DA ESCOLA MUNICIPAL MAURICIO DE NASSAU.;3;3-NOROESTE;3.1;Sim;execucao;ATENDIMENTO;;Vistoria
2015;06-junho;8017793215;2015-06-21;06:35;o usuario informa que no local se encontra um muro que esta com serios riscos de cair a qualquer momento,favor verificar com urgencia.;NOROESTE;ALTO DO MANDU;ALTO DO MANDU;RUA   MANDACARU;na rua do atacadão do alto mandu. perto da escola modelo.;3;3-NOROESTE;3.1;Sim;execucao;ATENDIMENTO;;Vistoria
2015;05-maio;8013577315;2015-05-12;09:30;DESEJA BREVIDADE EM VISTORIA EM BARREIRA POIS ESTA COM RISCO O MURO DE ARRIMO QUE FICA PRÓXIMO;NOROESTE;ALTO DO MANDU;ALTO DO MANDU;TVR DA LEVADA;PRÓXIMO AO BURACÃO E PADARIA RENATA;3;3-NOROESTE;3.1;Não;execucao;ATENDIMENTO;;Vistoria
2015;05-maio;8015662815;2015-05-30;21:37;USUÁRIO SOLICITA VISTORIA EM MURO COM RISCO DE DESABAMENTO, INFORMA QUE O MURO EM FRENTE A SUA RESIDÊNCIA ESTÁ COM GRANDE RISCO DE DESABAR EM CIMA DE SEU COMODO E DEVIDO AS CHUVAS OCORRIDAS O MESMO SE ENCONTRA AINDA MAIS DETERIORADO, PEDE URGÊNCIA NO ATENDIMENTO.;NOROESTE;ALTO DO MANDU;ALTO DO MANDU;RUA 1°TRAVESSA MANDACARU, N°23;NO FINAL DA RUA DO ATACADÃO MANDACARUNO BECO DO COLÉGIO MODELO;3;3-NOROESTE;3.1;Sim;execucao;ATENDIMENTO;;Vistoria
2015;03-marco;8007457015;2015-03-10;14:14;SOLICITA VISTORIA EM MURO DE ARRIMO QUE ESTÁ COM MUITAS RACHADURAS. E AGUA ESTÁ FOFANDO O MURO.;NOROESTE;ALTO DO MANDU;ALTO DO MANDU;TRV DAS LEVADAS, Nº 135;APOS O COLEGIO SILVIA JARDIM, 1ª RUA A DIREITA.;3;3-NOROESTE;3.1;Não;execucao;ATENDIMENTO;;Vistoria
2015;03-marco;8008849915;2015-03-23;12:59;USUARIA INFORMA QUE VIZINHO CONSTRUIRÃO UM DUPLEX EM AREA DE RISCO E QUE JA TINHA SIDO AVALIADO COMO DE RISCO MESMO ASSIM FOI DADO CONTINUIDADE A OBRA COLOCANDO EM RISCO MORADORES DA PROXIMIDADE. PEDE BREVIDADE;NOROESTE;ALTO DO MANDU;ALTO DO MANDU;2ª TRV  MANDACARU;RUA AO LADO DO ATACADÃO MANDACARU;3;3-NOROESTE;3.1;Não;execucao;ATENDIMENTO;;Vistoria
2015;03-marco;8008324315;2015-03-18;07:44;SOLICITA/SE VISTORIA NO IMOVEL DEVIDO TER FOCOS DE CUPIM E TAMBÉM CORTE DE ARVORE (PÉ DE CAJA) DE GRANDE PORTE QUE PODE CAIR ENCIMA DE SUA RESIDENCIA, A MESMA JÁ DESAPROPRIO O IMOVEL DEVIDO AO RISCO QUE TEME, FAVOR VERIFICAR A SITUAÇÃO.;NOROESTE;ALTO DO MANDU;ALTO DO MANDU;RUA QUATRO DE MARÇO Nº 287;AO LADO DA IGREJA BATISTA DO ALTO DO MANDU;3;3-NOROESTE;3.1;Sim;execucao;ATENDIMENTO;;Vistoria
2015;01-janeiro;8001775015;2015-01-21;08:51;USUÁRIO SOLICITA COLOCAÇÃO DE LONA COM URGÊNCIA.;NOROESTE;ALTO DO MANDU;ALTO DO MANDU;RUA DA LEVADA N, 110;APOS A ESCOLA SILVA JARDIM A SEGUNDA ENTRADA A DIREITA.;3;3-NOROESTE;3.1;Não;execucao;ATENDIMENTO;;Colocacao de Lonas Plasticas
2015;01-janeiro;8001499215;2015-01-16;11:25;USUÁRIA SOLICITA CAPINAÇÃO EM MURO DE ARRIMO.;NOROESTE;ALTO DO MANDU;ALTO DO MANDU;RUA MUNIZ GALVÃO;PRÓXIMO AO ANTIGO BURACÃO.;3;3-NOROESTE;3.1;Não;execucao;ATENDIMENTO;;Vistoria
2014;10-outubro;8018748214;2014-10-24;15:11;USUÁRIA INFORMA QUE AS PAREDES DE SUA RESIDENCIA ESTÃO RACHADAS,A MESMA ESTA COM MEDO QUE ELAS CAIAM,PEDE URGÊNCIA NA VISTORIA.;NOROESTE;ALTO DO MANDU;ALTO DO MANDU;RUA SEGUNDA TRAVESSA CAMETA N331 A;PRÓXIMO ÃO TERMINAL DO ALTO DO MANDU.;3;3-NOROESTE;3.1;Não;execucao;ATENDIMENTO;;Vistoria
2014;09-setembro;8016372514;2014-09-22;10:22;USUÁRIA SOLICITA VISTORIA COM URGÊNCIA EM IMÓVEL POIS DEVIDO INFILTRAÇÃO DA CANALETA PRÓX. A CASA  A RESIDENCIA ESTÁ COM RACHADURAS E RISCO AOS MORADORES.;NOROESTE;ALTO DO MANDU;ALTO DO MANDU;RUA 2 TRAV. CAMETÁ  N. 331  CASA AMARELA;PRÓX. AO TERMINAL DE ÔNIBUS DO ALTO DO MANDÚ.;3;3-NOROESTE;3.1;Não;execucao;ATENDIMENTO;;Vistoria
2014;09-setembro;8014938114;2014-09-08;10:04;USUÁRIA SOLICITA VISTORIA EM BARREIRA, INFORMA QUE A BARREIRA ESTA COM INFILTRAÇÃO E A GUA ESTA ENTRANDO NA RESIDENCIA DA MESMA.;NOROESTE;ALTO DO MANDU;ALTO DO MANDU;RUA DAS LEVADAS N 90;PROX: O BURACÃO.;3;3-NOROESTE;3.1;Não;execucao;ATENDIMENTO;;Vistoria
2014;06-junho;8009983214;2014-06-29;14:09;DEFERIR VISTORIA EM CASA URGENTE (REBOCO DE DESPEDAÇANDO E MUITA UMIDADE);NOROESTE;ALTO DO MANDU;ALTO DO MANDU;RUA AROEIRA, 142;FICA PROX A ESCOLA VILA SEZAMO / SENTIDO AÇUDE DA MACAXEIRA;Não informada;Não informado;NOROESTE - 1;Sim;execucao;ATENDIMENTO;;
2014;06-junho;8009925214;2014-06-27;14:49;vistoria em imovel usuaria inf que agua devido a uma cratera na rua esta escoando para o seu imovel solicita uma vistoria com urgencia pois teme queda do imovel a mesma inf esta danificando a calçada e batente do seu imovel;NOROESTE;ALTO DO MANDU;alto do mandu;rua ameliopoles n°118;indi pelo beco do quiabo na subida do restaurante mao de vaca do bete contato/86257553/ 99597129;Não informada;Não informado;NOROESTE - 1;Não;execucao;ATENDIMENTO;;
2014;05-maio;8007860014;2014-05-22;11:18;USUÁRIO SOLICITA VISTORIA EM MURO POIS O MESMO ESTÁ COM RACHADURAS E RISCO DE QUEDA. ATENDER COM URGÊNCIA.;NOROESTE;ALTO DO MANDU;ALTO DO MANDÚ;RUA AMELIÓPOLIS  N. 63;PRÓX. A MÃO DE VACA DO BETO.;Não informada;Não informado;NOROESTE - 1;Não;execucao;ATENDIMENTO;;
2014;07-julho;8011276814;2014-07-15;07:35;USUÁRIO SOLICITA COLOCAÇÃO DE LONA, O MESMO INFORMA QUE A BARREIRA CHEGOU A DESLIZAR.;NOROESTE;ALTO DO MANDU;ALTO DO MANDU;2TR   SIRIJI, N°65;PRÓXIMO A ESCOLA SÃO MIGUEL.;3;3-NOROESTE;3.1;Sim;execucao;ATENDIMENTO;;Colocacao de Lonas Plasticas
2014;04-abril;8005790514;2014-04-15;16:04;VISTORIA EM MURO DE ALVENARIA ATERRADO ESTANDO ESTUFADO EM LOCAL DE PEDESTRES. TEME ACIDENTES SOLICITA URGENCIA O MAIS RAPIDO POSSIVEL.;NOROESTE;ALTO DO MANDU;ALTO DO MANDU;RUA AMELIOPOLES  S/N;SUBIDA DA MAO VACA NO BECO DO QUIABO PROX AO CENTRO ESPIRITA;Não informada;Não informado;NOROESTE - 1;Não;execucao;ATENDIMENTO;;
2014;04-abril;8005391314;2014-04-10;08:07;usuário solicita uma vistoria no muro da sua residencia pois devido a uma pequena reforma na canaleta, o muro da sua casa foi danificado.;NOROESTE;ALTO DO MANDU;ALTO DO MANDU;rua cameta, 347/369;pela av norte, vai pela padaria mandacaru, vira, primeira lombada a esquerda.;Não informada;Não informado;NOROESTE - 1;Não;execucao;ATENDIMENTO;;
2014;03-marco;8003459014;2014-03-11;19:01;INCÊNDIO EM RESIDENCIA. SARGENTO DO CORPO DE BOMBEIROS INFORMA QUE HOUVE UM INCÊNDIO NA RESIDENCIA, ATINGINDO AS PAREDES E TODO O TELHADO. SOLICITA UMA VISTORIA NO LOCAL COM URGÊNCIA.;NOROESTE;ALTO DO MANDU;ALTO DO MANDU;RUA CAÇAPAVA, Nº 60;PRÓXIMO A PADARIA MANDACARU E A IGREJA ASSEMBLEIA DE DEUS.;Não informada;Não informado;NOROESTE - 1;Sim;execucao;ATENDIMENTO;;
2014;03-marco;8003546014;2014-03-12;16:23;VISTORIA EM MURO DE ARRIMO. PEDE URGENCIA O MAIS RAPIDO POSSIVEL A QUALQUER MOMENTO PODE ACONTECE ACIDENTES.;NOROESTE;ALTO DO MANDU;ALTO DO MANDU;RUA MUNIZ GALVAO N°1999;PROX  LAN HAUSE DE FERNANDO;Não informada;Não informado;NOROESTE - 1;Não;execucao;ATENDIMENTO;;
2014;03-marco;8003830014;2014-03-14;15:27;USUÁRIO SOLICITA COM URGÊNCIA  VISTORIA NA RESIDENCIA INFORMA QUE O MURO ESTA COM RISCO DE QUEDA.;NOROESTE;ALTO DO MANDU;ALTO DO MANDU N 129;RUA CURURIPI;INDO PELA AVENIDA EURICO CHAVES NA SUBIDA DA IGREJA CATOLICA ALTO DO MANDU;Não informada;Não informado;NOROESTE - 1;Não;execucao;ATENDIMENTO;;
2014;03-marco;8004406714;2014-03-21;11:25;ESTÃO FAZENDO UMA  RESIDENCIA POR CIMA DO MURO DE ARRIMO. NÃO É A PRIMEIRA VEZ QUE ESTÃO FAZENDO, SE TRATA DE ÁREA DE RISCO.;NOROESTE;ALTO DO MANDU;ALTO DO MANDU;RUA DA LEVADA,106;APÓS O COLÉGIO SILVA JARDIM, A PRIMEIRA ENTRADA;Não informada;Não informado;NOROESTE - 1;Não;execucao;ATENDIMENTO;;
2014;03-marco;8004622114;2014-03-27;08:28;construção irregular em cima do muro de arrimo.;NOROESTE;ALTO DO MANDU;ALTO DO MANDU;rua da levada, 106.;após o colegio silva jardim;Não informada;Não informado;NOROESTE - 1;Não;execucao;ATENDIMENTO;;
2014;01-janeiro;8001138114;2014-01-30;09:31;PEDE VISTORIA EM IMOVEL QUE ESTA PRESTES A CAIR, COM MUITAS RACHADURAS. CASA ESTA FECHADA POR FALTA DE CONDIÇOES DE MORADA, PEDE VISTORIA COM URGENCIA;NOROESTE;ALTO DO MANDU;ALTO DO MANDÚ;RUA DOM JOSE PEREIRA, 31H;PROX A BARRACA DO IRMÃO.;Não informada;Não informado;NOROESTE - 1;Não;execucao;ATENDIMENTO;;
2012;06-junho;8003809412;2012-06-14;12:39;RECOLOCAÇÃO DE LONA;NOROESTE;ALTO DO MANDU;CASA AMARELA;RUA CAMETA, 326;PROX AO TERMINAL DE ONIBUS DO ALTO DO MANDU NA RUA DA ASSEMBLEIA DE DEUS;Não informada;Não informado;;Não;execucao;ATENDIMENTO;;
2012;04-abril;8001406012;2012-04-17;12:57;VISTORIA EM MURO;NOROESTE;ALTO DO MANDU;ALTO DO MANDU;RUA CAMETA N 326 A;PROXIMO DO TERMINAL DO ONIBUS ALTO DO MANDU;Não informada;Não informado;;Não;completo;ATENDIMENTO;;
2012;04-abril;8001458012;2012-04-18;07:05;O USUARIO PEDE A VISTORIA DO MURO, POIS ,O MESMO INFORMA QUE ESTA SOLTO E QUE A  QUALQUER MOMENTO PODE CAIR.;NOROESTE;ALTO DO MANDU;ALTO DO MANDU;RUA CAMETA N/346;PROXIMO AO TERMINAL DO ONIBUS DO ALTO DO MANDU.;Não informada;Não informado;;Não;completo;ATENDIMENTO;;
2012;04-abril;8001404712;2012-04-17;12:48;VISTORIA EM CASA. CASA DE 1º ANDAR COM PAREDES RACHADAS, COM INFILTRAÇÕES QUANDO CHOVE. USUARIO ESTÁ COM MEDO DE QUEDA.;NOROESTE;ALTO DO MANDU;ALTO DO MANDU;RUA CAMETA N 326 A;PROX AO TERMINAL DO ÔNIBUS DO ALTO DO MANDU;Não informada;Não informado;;Não;execucao;ATENDIMENTO;;
2013;01-janeiro;8000577313;2013-01-18;08:07;a usuaria informa que estão construindo um motel no local onde há um muro com rachaduras. a construção esta sendo praticamente por cima do muro e esta ocorrendo perigo às casas do lado. usuaria deseja a vistoria no local.;NOROESTE;ALTO DO MANDU;largo do buracão;rua arataca;motel carícias, proximo a panificadora pan renata.;Não informada;Não informado;NOROESTE - 1;Não;completo;ATENDIMENTO;;
2012;05-maio;8002641212;2012-05-21;10:07;usuario solicita colocaçao de lona.;NORDESTE;ALTO DO REFUGIO;NOVA DESCOBETAR;SUBIDA DONA COTINHA N 84;EM FRENTE A BARRACA DE SEU PEDRO. PROCURAR POR DINHA OU SUELY.;Não informada;Não informado;;Não;execucao;ATENDIMENTO;;
2016;08-agosto;8047275816;2016-08-02;09:14;USUARIA SOLICITA REPOSIÇÃO DE LONA COM BREVIDADE;NOROESTE;ALTO JOSE BONIFACIO;ALTO JOSE BONIFACIO;RUA NOBREGA, 312;PX A OFICINA DE DARIO NA SUBIDA;3;3-NOROESTE;3.2;Não;execucao;ATENDIMENTO;;Colocacao de Lonas Plasticas
2016;08-agosto;8049732716;2016-08-10;10:34;BARREIRA NECESSITA DE VISTORIA, CAPINAÇÃO, RECOLOCAÇÃO DA LONA DEVIDO A MESMA QUE ESTÁ NA BARREIRA ESTPA DANIFICADA.;NOROESTE;ALTO JOSE BONIFACIO;ALTO JOSE BONIFACIO;RUA DR  BENEVENUTO TELES NETO, N 91;RUA DA ASSOCIAÇÃO, FINAL DA ESCADARIA;3;3-NOROESTE;3.2;Não;execucao;ATENDIMENTO;;Colocacao de Lonas Plasticas
2016;08-agosto;8049732716;2016-08-10;10:34;BARREIRA NECESSITA DE VISTORIA, CAPINAÇÃO, RECOLOCAÇÃO DA LONA DEVIDO A MESMA QUE ESTÁ NA BARREIRA ESTPA DANIFICADA.;NOROESTE;ALTO JOSE BONIFACIO;ALTO JOSE BONIFACIO;RUA DR  BENEVENUTO TELES NETO, N 91;RUA DA ASSOCIAÇÃO, FINAL DA ESCADARIA;3;3-NOROESTE;3.2;Não;execucao;ATENDIMENTO;;Vistoria
2016;08-agosto;8049633916;2016-08-10;08:19;USUÁRIA INFORMA QUE MORADOR ESTAR CAVANDO A BARREIRA. URGENTE.;NOROESTE;ALTO JOSE BONIFACIO;ALTO JOSE BONIFACIO;RUA ALTO DO BRASIL, N 436.;PRÓXIMO AO BAR DO NEM E APÓS A PADARIA DE CAISARA.;3;3-NOROESTE;3.2;Não;execucao;ATENDIMENTO;;Vistoria
2016;08-agosto;8048345016;2016-08-04;15:47;USUARIO INFORMA QUE O VIZINHO ESTÁ CVANDO A BARREIRA E COLOCANDO EM RISCO A SUA RESIDENCIA, A MESMA SOLICITA  URGENCIA PARA SER FEITA A VISTORIA.;NOROESTE;ALTO JOSE BONIFACIO;ALTO JOSE BONIFACIO;RUA ALTO DA CONQUISTA N, 3244;EM FRENTE A CAIXA DAGUA DO ALTO JOSE BONIFACIO;3;3-NOROESTE;3.2;Não;execucao;ATENDIMENTO;;Vistoria
2016;07-julho;8044059216;2016-07-18;10:04;USUARIA INF QUE SURGIRAM RACHADURAS EM SUA RESIDENCIA DEVIDO A UMA CONSTRUÇAO IRREGULAR AO LADO DE SUA CASA. A MESMA PEDE URGENCIA;NOROESTE;ALTO JOSE BONIFACIO;ALTO JOSE BONIFACIO;RUA LAJEDO, 139;NO TERMINAL DE ONIBUS, ESCADARIA PROXIMA A FARMACIA BRASIL;3;3-NOROESTE;3.2;Não;execucao;ATENDIMENTO;;Vistoria
2016;07-julho;8044003716;2016-07-17;15:45;USUARIO INFORMA QUE O MORADOR ESTA FAZENDO UMA CONSTRUÇAO NA RESIDENCIA QUE FICA ENCIMA DA BARREIRA E ESTAO JOGANDO AS METRALHAS E OUTROS MATERIAIS NA BARREIRA E QUANDO CHOVER VAI DESLIZAR TUDO NA RESIDENCIA DA SOLICITANTE. ELA PEDE UMA VISTORIA COM URGENCIA NO LOCAL.;NOROESTE;ALTO JOSE BONIFACIO;ALTO JOSE BONIFACIO;RUA PORANGABA N120A;ESCOLA MUNICIPAL CORREGO DO EUCLIDES.;3;3-NOROESTE;3.2;Não;execucao;ATENDIMENTO;;Vistoria
2016;07-julho;8043798616;2016-07-15;10:25;USUÁRIA SOLICITA VISTORIA EM SUA CASA QUE ESTA COM RACHADURAS E A BARREIRA DESLIZOU DEVIDO AO ROMPIMENTO DE UM CANO NA COMPESA. URGENTE. RISCOS.;NOROESTE;ALTO JOSE BONIFACIO;ALTO JOSE BONIFACIO;RUA GUSTAVO BARROSO, N 77.;POR TRÁS DA CRECHE CRIANÇA FELIZ E DO POSTO DE SAÚDE.;3;3-NOROESTE;3.2;Não;execucao;ATENDIMENTO;;Vistoria
2016;07-julho;8042456416;2016-07-12;08:51;USUÁRIA SOLICITA VISTORIA E LONA EM BARREIRA COM URGÊNCIA.;NOROESTE;ALTO JOSE BONIFACIO;ALTO JOSE BONIFACIO;RUA CORREGO DO EUCLIDES N. 1930;PRÓX. A OFICINA MARTELINHO DE OURO.;3;3-NOROESTE;3.2;Não;execucao;ATENDIMENTO;;Colocacao de Lonas Plasticas
2016;07-julho;8042456416;2016-07-12;08:51;USUÁRIA SOLICITA VISTORIA E LONA EM BARREIRA COM URGÊNCIA.;NOROESTE;ALTO JOSE BONIFACIO;ALTO JOSE BONIFACIO;RUA CORREGO DO EUCLIDES N. 1930;PRÓX. A OFICINA MARTELINHO DE OURO.;3;3-NOROESTE;3.2;Não;execucao;ATENDIMENTO;;Vistoria
2016;07-julho;8040884916;2016-07-06;10:24;USUÁRIA SOLICITA VISTORIA EM CONSTRUÇÃO IRREGULAR DE PRÉDIO NA BASE DE UMA BARREIRA (ONDE A DEFESA CIVIL JÁ HAVIA EMBARGADO A OBRA), PORÉM O RESPONSÁVEL PELA OBRA CONTINUA COM A CONSTRUÇÃO COLOCANDO MORADORES VIZINHOS EM RISCO.;NOROESTE;ALTO JOSE BONIFACIO;ALTO JOSE BONIFACIO;RUA 2 TRAV. HIDROLÂNDIA  N.15;PRÓX. AO TERMINAL DE ÔNIBUS DA BOMBA DO HEMETÉRIO.;3;3-NOROESTE;3.2;Não;execucao;ATENDIMENTO;;Vistoria
2016;07-julho;8040183016;2016-07-04;11:36;USUÁRIA SOLICITA COLOCAÇÃO DE LONA COM URGÊNCIA.;NOROESTE;ALTO JOSE BONIFACIO;CGO. DO EUCLIDES;RUA ALBERTO FACÃO N, 1945;PROX: A OFICINA MARTELINHO DE OURO.;3;3-NOROESTE;3.2;Não;execucao;ATENDIMENTO;;Colocacao de Lonas Plasticas
2016;07-julho;8040134016;2016-07-04;11:01;USUARIA SOLICITA UMA VISTORIA EM SUA RESIDENCIA POIS O SEU VIZINHO FEZ UMA CONSTRUÇÃO IRREGULAR E OFERECE RISCO DE DESLIZAMENTO DA BARREIRA E SOLICITA URGENCIA;NOROESTE;ALTO JOSE BONIFACIO;ALTO JOSE BONIFACIO;RUA VISCONDE DE SA BANDEIRA, 137;POR TRAS DA CRECHE CRIANÇA FELIZ EM FRENTE A BARRACA DO SENHOR NILDO;3;3-NOROESTE;3.2;Não;execucao;ATENDIMENTO;;Vistoria
2016;07-julho;8046320016;2016-07-27;13:18;BARREIRA E IMOVEL NECESSITA DE VISTORIA.;NOROESTE;ALTO JOSE BONIFACIO;ALTO JOSE BONIFACIO;RUA ARYS PETER, N 18;TERMINAL DO BREJO;3;3-NOROESTE;3.2;Não;execucao;ATENDIMENTO;;Colocacao de Lonas Plasticas
2016;07-julho;8046757916;2016-07-29;15:42;USUARIO SOLICITA A REPOSIÇÃO DA LONA PLÁSTICA;NOROESTE;ALTO JOSE BONIFACIO;ALTO JOSE BONIFACIO;RUA SAO DOMINGO SAVIO N, 645;PROXIMO AS CASAS PEREIRA NA ENTRADA DA OFICINA DE DARIO;3;3-NOROESTE;3.2;Não;execucao;ATENDIMENTO;;Colocacao de Lonas Plasticas
2016;07-julho;8046320016;2016-07-27;13:18;BARREIRA E IMOVEL NECESSITA DE VISTORIA.;NOROESTE;ALTO JOSE BONIFACIO;ALTO JOSE BONIFACIO;RUA ARYS PETER, N 18;TERMINAL DO BREJO;3;3-NOROESTE;3.2;Não;execucao;ATENDIMENTO;;Vistoria
2016;06-junho;8033565916;2016-06-07;21:25;a solicitante pede o corte de uma arvore que fica na barreira,favor verificar.contt: 84053149;NOROESTE;ALTO JOSE BONIFACIO;CGO. DO EUCLIDES;rua do tapa;vindo pela ladeira do boi fica perto da igreja batista.;3;3-NOROESTE;3.2;Sim;execucao;ATENDIMENTO;;Vistoria
2016;06-junho;8033016516;2016-06-06;16:09;USUARIO SOLICITA A VISOTIA EM BARREIRA COM VAZAMENTO CAUSADO POR UM CANO QUE ESTÁ ESTOURADO.;NOROESTE;ALTO JOSE BONIFACIO;ALTO JOSE BONIFACIO;ALTO JOSÉ BONIFÁCIO N, 44;SUBINDO A ESCADARIA O PRIMEIRO QUEBRA MOLA AO LADO ESQUERDO;3;3-NOROESTE;3.2;Não;execucao;ATENDIMENTO;;Vistoria
2016;06-junho;8032725216;2016-06-06;09:36;USUARIA SOLICITA DE URGENCIA DA VISTORIA NESTA BARREIRA, E UMA LONA;NOROESTE;ALTO JOSE BONIFACIO;ALTO JOSE BONIFACIO;RUA VISCONDE DE SA BANDEIRA N 137;POR TRAS DA CRECHE CRIANCA FELIZ;3;3-NOROESTE;3.2;Não;execucao;ATENDIMENTO;;Colocacao de Lonas Plasticas
2016;06-junho;8032725216;2016-06-06;09:36;USUARIA SOLICITA DE URGENCIA DA VISTORIA NESTA BARREIRA, E UMA LONA;NOROESTE;ALTO JOSE BONIFACIO;ALTO JOSE BONIFACIO;RUA VISCONDE DE SA BANDEIRA N 137;POR TRAS DA CRECHE CRIANCA FELIZ;3;3-NOROESTE;3.2;Não;execucao;ATENDIMENTO;;Vistoria
2016;06-junho;8032511216;2016-06-03;14:44;MURO DE ARRIMO COM RACHADURAS E COM INFILTRAÇÃO.;NOROESTE;ALTO JOSE BONIFACIO;CGO. JOSE GRANDE;RUA SENA MADUREIRA, N 91;EM FRENTE A CRECHE UNIDOS VENCEREMOS.;3;3-NOROESTE;3.2;Não;execucao;ATENDIMENTO;;Vistoria
2016;06-junho;8032347816;2016-06-03;11:25;USUARIA PEDE URGENCIA POIS A BARREIRA ESTA DESCOBERTA;NOROESTE;ALTO JOSE BONIFACIO;ALTO JOSE BONIFACIO;RUA ALTO DA CONQUISTA, 3278;EM FRENTE A CAIXA DAGUA;3;3-NOROESTE;3.2;Não;execucao;ATENDIMENTO;;Colocacao de Lonas Plasticas
2016;06-junho;8032343216;2016-06-03;11:22;USUARIA SOLICITA VISTORIA NA BARREIRA DESLIZOU HOJE DEVIDO AS FORTES CHUVAS SEM VITIMAS SOLICITA TAMBEM REPOSIÇÃO DE LONA PLASTICAS POSSUI RISCO DE NOVO DESLIZAMENTO NO LOCAL E SOLICITA URGENCIA;NOROESTE;ALTO JOSE BONIFACIO;ALTO JOSE BONIFACIO;TRV BELA VISTA, 3361;POR TRAS ONZE DELMONTE PROXIMO A QUADRA DE ESPORTE;3;3-NOROESTE;3.2;Não;execucao;ATENDIMENTO;;Colocacao de Lonas Plasticas
2016;06-junho;8032343216;2016-06-03;11:22;USUARIA SOLICITA VISTORIA NA BARREIRA DESLIZOU HOJE DEVIDO AS FORTES CHUVAS SEM VITIMAS SOLICITA TAMBEM REPOSIÇÃO DE LONA PLASTICAS POSSUI RISCO DE NOVO DESLIZAMENTO NO LOCAL E SOLICITA URGENCIA;NOROESTE;ALTO JOSE BONIFACIO;ALTO JOSE BONIFACIO;TRV BELA VISTA, 3361;POR TRAS ONZE DELMONTE PROXIMO A QUADRA DE ESPORTE;3;3-NOROESTE;3.2;Não;execucao;ATENDIMENTO;;Vistoria
2016;06-junho;8032272816;2016-06-03;10:38;usuaria solicita de urgencia de uma vistoria na residencia que esta tendo filtraçao , de uma agua que desce de um vizinho , que esta prejudicando sua casa;NOROESTE;ALTO JOSE BONIFACIO;ALTO JOSE BONIFACIO;RUA VISCONDE DE SA BANDEIRA n 20;prox ao posto de saude , entra a direita , primeira  a esquerda;3;3-NOROESTE;3.2;Não;execucao;ATENDIMENTO;;Vistoria
2016;06-junho;8032254016;2016-06-03;10:28;USUARIO DESEJA A COLOCAÇAO DE LONA E VISTORIA NA SUA BARREIRA;NOROESTE;ALTO JOSE BONIFACIO;CGO. DO EUCLIDES;RUA ALTO JOSE BONIFACIO,40;PROXIMO A IGREJA BATISTA;3;3-NOROESTE;3.2;Não;execucao;ATENDIMENTO;;Colocacao de Lonas Plasticas
