ano;mes;processo_numero;solicitacao_data;solicitacao_hora;solicitacao_descricao;solicitacao_regional;solicitacao_bairro;solicitacao_localidade;solicitacao_endereco;solicitacao_roteiro;rpa_codigo;rpa_nome;solicitacao_microrregiao;solicitacao_plantao;processo_situacao;processo_tipo;processo_origem;processo_solicitacao
2014;08-agosto;8014040514;2014-08-27;11:12;USUÁRIA SOLICITA CAPINAÇÃO EM SUA BARREIRA. URGENTE.;NORTE;AGUA FRIA;ALTO DO PEREIRINHA;RUA   GRENAL, N°112 B;APÓS AO MERCADINHO DO MARIO PRIMEIRA DIREITA E SEGUNDA ESQUERDA. A CASA ESTA EM FRENTE.;2;2-NORTE;2.2;Não;execucao;ATENDIMENTO;;Vistoria
2014;08-agosto;8014012114;2014-08-27;09:19;USUÁRIO INFORMA QUE A CASA FOI CONDENADA PELA DEFESA CIVIL E MORADORES FORAM RETIRADOS DO LOCAL, A QUAL ESTÃO RECEBENDO AUXILIO MORADIA, O MESMO INFORMA QUE O FILHO DO DONO DA CASA ESTA RESIDINDO NA CASA QUE ESTA CONDENADA (PRIMEIRO ANDAR), MORADOR DA CASA DE BAIXO ESTA COM MEDO QUE ACONTEÇA ALGO. URGENTE.;NORTE;AGUA FRIA;CGO. DO DEODATO;RUA   DEODORO DA FONSECA, N°31;APÓS A IGREJA ASSEMBLEIA DE DEUS DO CÓRREGO DEODATO.;2;2-NORTE;2.2;Não;execucao;ATENDIMENTO;;Vistoria
2014;08-agosto;8013747814;2014-08-21;21:32;USUARIA INFORMA QUE SUA CASA ESTA MINANDO AGUA, ESTA COM RACHADURAS, QUINTAL CHEIA DE MATOS.;NORTE;AGUA FRIA;CGO. DO DEODATO;RUA ALTO DO BONITO N°400 A;PROX AO MERCADINHO  SR: MARIO;2;2-NORTE;2.2;Sim;execucao;ATENDIMENTO;;Vistoria
2014;08-agosto;8013634914;2014-08-21;08:41;usuária solicita o corte da arvore, informa que os galhos estão caindo pede urgência.;NORTE;AGUA FRIA;CGO. DO DEODATO;RUA   DEODORO DA FONSECA;prox:  a igreja assembleia de deus;2;2-NORTE;2.2;Não;execucao;ATENDIMENTO;;Vistoria
2014;08-agosto;8013632614;2014-08-21;08:34;/USUARIO SOLICITA VISTORIA E COLOCAÇÃO DE LONA EM BARREIRA COM RISCO DE DESLIZAMENTO. O MESMO PEDE URGENCIA.;NORTE;AGUA FRIA;CGO. DO DEODATO;RUA MONTE ALEGRE, 30 A;DEPOIS DA IGREJA ASSEMBLEIA DE DEUS;2;2-NORTE;2.2;Não;execucao;ATENDIMENTO;;Colocacao de Lonas Plasticas
2014;08-agosto;8013632614;2014-08-21;08:34;/USUARIO SOLICITA VISTORIA E COLOCAÇÃO DE LONA EM BARREIRA COM RISCO DE DESLIZAMENTO. O MESMO PEDE URGENCIA.;NORTE;AGUA FRIA;CGO. DO DEODATO;RUA MONTE ALEGRE, 30 A;DEPOIS DA IGREJA ASSEMBLEIA DE DEUS;2;2-NORTE;2.2;Não;execucao;ATENDIMENTO;;Vistoria
2014;08-agosto;8013388814;2014-08-15;17:37;MORADORA INFORMA QUE OUTRO MORADOR DA RUA ESTÁ CONSTRUINDO UMA FOSSA NO MEIO DA BARREIRA. DIZ QUE PODE CORRER RISCO DE DESLIZAMENTO. PEDE VISTORIA COM URGENCIA.;NORTE;AGUA FRIA;CGO. DO DEODATO;RUA ARATINGA, Nº 88;APOS A ASSEMBLEIA DE DEUS. PROXIMO A ESCOLA ALDA ROMEU.;2;2-NORTE;2.2;Não;execucao;ATENDIMENTO;;Vistoria
2014;08-agosto;8013313814;2014-08-15;09:15;USUÁRIA INFORMA QUE MORADOR DA PARTE ALTA ESTA REALIZANDO CONSTRUÇÃO EM CIMA INDEVIDA COLOCANDO EM RISCO MURO DE ARRIMO QUE SEGUNDO ELA ESTA TAMBÉM O COM INFILTRAÇÃO.PROCURAR PELA SENHORA MARTA QUE É A PROPRIETÁRIA DA RESIDENCIA DE ONDE ESTA ACONTECENDO A CONSTRUÇÃO INDEVIDA.;NORTE;AGUA FRIA;CGO. DO DEODATO;RUA ARATINGUA, 88;APOS A ASSEMBLEIA DE DEUS E ESCOLA ALDA ROMEU;2;2-NORTE;2.2;Não;execucao;ATENDIMENTO;;Vistoria
2014;08-agosto;8012702014;2014-08-06;10:03;USUÁRIA INFORMA QUE SEU VIZINHO CAVOU SUA BARREIRA PARA FAZER UM PRIMEIRO ANDAR, A QUAL ATINGIU A COLUNA DA CASA DE N°315, DEVIDO AO ACONTECIMENTO A CASA SE ENCONTRA COM RACHÕES NA COZINHA E NA SALA, COM RISCOS DE MAIS RACHÕES. URGENTE.NÃO OUVE DESLIZAMENTO, MAS ESTA COM RISCOS.;NORTE;AGUA FRIA;ALTO DO PEREIRINHA;RUA DR  PEREIRA DA SILVA, N°315;SUBINDO A LADEIRA DO DEPOSITO DO ITALIANO, NO FIM DA LADEIRA.;2;2-NORTE;2.2;Não;execucao;ATENDIMENTO;;Vistoria
2014;07-julho;8012187914;2014-07-29;19:31;USUARIO INFORMA QUE O PÉ DE CASTANHOLA ESTÁ PRESTES A CAIR, POIS AS RAIZES DA ARVORE SE ENCONTRA TODA EXPOSTA, NO MOMENTO ELÁ NÃO ESTÁ TOMBADA;NORTE;AGUA FRIA;CGO. SAO SEBASTIAO;RUA ABAIABA Nº79;POR TRÁS DA CEDE DO CLUBE CARNAVALESCO DE ÁGUA FRIA;2;2-NORTE;2.2;Sim;execucao;ATENDIMENTO;;Vistoria
2014;07-julho;8011997714;2014-07-25;14:53;VISTORIA EM BARREIRA USUARIA INF QUE BARREIRA DESLIZOU E ESTA A CERCA DE 1 METRO DO IMOVEL SOLICITA URGENCIA;NORTE;AGUA FRIA;CGO. SAO JOSE;RUA JOSE N°231 CASA A;PROX A ENTRADA DO CORREDO DO DEODATO E AO MERCADINHO DO DO;2;2-NORTE;2.2;Não;execucao;ATENDIMENTO;;Vistoria
2014;07-julho;8011909014;2014-07-24;13:47;USUARIA SOLICITA UMA VISTORIA NA BARREIRA E UMA COLOCAÇAO DE LONA NAO OCORREU DESLIZAMENTO;NORTE;AGUA FRIA;CGO. DO DEODATO;RUA   ANITOPOLIS N°306;PROX A BARRACA DE LÚ;2;2-NORTE;2.2;Não;execucao;ATENDIMENTO;;Colocacao de Lonas Plasticas
2014;07-julho;8011909014;2014-07-24;13:47;USUARIA SOLICITA UMA VISTORIA NA BARREIRA E UMA COLOCAÇAO DE LONA NAO OCORREU DESLIZAMENTO;NORTE;AGUA FRIA;CGO. DO DEODATO;RUA   ANITOPOLIS N°306;PROX A BARRACA DE LÚ;2;2-NORTE;2.2;Não;execucao;ATENDIMENTO;;Vistoria
2014;07-julho;8011906114;2014-07-24;13:36;USUARIA SOLICITA UMA RETIRADA DE ARVORE DE PEQUENO PORTE NA BARREIRA;NORTE;AGUA FRIA;CGO. DO DEODATO;RUA   ANITOPOLIS N°306;PROCURAR POR LÚ NO N°235 APOS A IGREJA BATISTA E PROX A BARRACA DE LÚ;2;2-NORTE;2.2;Não;execucao;ATENDIMENTO;;Vistoria
2014;07-julho;8011758214;2014-07-22;16:16;colocaçao de lona;NORTE;AGUA FRIA;CGO. DO DEODATO;rua corrego do deodato n442;prox do antigo alda romeu nao ocorreu deslizamentos;2;2-NORTE;2.2;Não;execucao;ATENDIMENTO;;Colocacao de Lonas Plasticas
2014;06-junho;8009080214;2014-06-16;11:47;USUÁRIA SOLICITA A REPOSIÇÃO DE LONA NA BARREIRA COM URGÊNCIA, POIS ESTÁ COM UM RISCO DE QUEDA.;NORTE;AGUA FRIA;CÓRREGO DO DEODATO;RUA MONTE ALEGRE, Nº 30 A;DEPOIS DA IGREJA ASSEMBLÉIA DE DEUS.;Não informada;Não informado;NORTE - 2;Não;execucao;ATENDIMENTO;;
2014;06-junho;8008826014;2014-06-11;11:49;CEL: 8549/1275USUÁRIA DESEJA AVALIAÇÃO DE IMÓVEL QUE ESTÁ COM RACHADURAS E INFILTRAÇÃO.;NORTE;AGUA FRIA;ALTO DO PASCOAL;RUA SOLDADO ABELARDO ROSA, 83;PRÓXIMO A FARMASARA;Não informada;Não informado;NORTE - 2;Não;execucao;ATENDIMENTO;;
2014;06-junho;8008752714;2014-06-11;08:57;USUÁRIO SOLICITA COLOCAÇÃO DE LONA;NORTE;AGUA FRIA;ALTO SANTA TEREZINHA;rua solemar, 97;POR TRAS DA DELEGACIA;Não informada;Não informado;NORTE - 2;Não;execucao;ATENDIMENTO;;
2014;06-junho;8008732614;2014-06-10;13:05;USUÁRIA SOLICITA VISTORIA EM MURO DE ARRIMO POIS ESTÁ COM RISCO DE QUEDA E COM INFILTRAÇÃO DE ÁGUA DA CANALETA. ATENDER COM URGÊNCIA.;NORTE;AGUA FRIA;ALTO DO PENERINHA;RUA VIOLETA N. 32;EM FRENTE AO EXTRABOM DE ÁGUA FRIA.;Não informada;Não informado;NORTE - 2;Não;execucao;ATENDIMENTO;;
2014;06-junho;8008642714;2014-06-08;11:20;A USUÁRIA SOLICITA UMA VISTORIA NA PAREDE DE SUA RESIDENCIA QUE ESTAR COM RACHADURAS ESTA COM RISCO DE CAIR.;NORTE;AGUA FRIA;ALTO DO PASCOAL;RUA LIDIA RODRIGUES ALVES;PRÓXIMO AO TERMINAL DO ALTO DO PASCOAL;Não informada;Não informado;NORTE - 2;Sim;execucao;ATENDIMENTO;;
2014;06-junho;8008547414;2014-06-05;11:36;/USUARIA SOLICITA VISTORIA EM CASA QUE ESTA COM RISCO DEVIDO A UMA INFILTRAÇÃO DE UM ESGOTO ONDE A PAREDE DO QUARTA JA DESABOU. A MESMA PEDE URGENCIA;NORTE;AGUA FRIA;CGO SAO SEBASTIAO;RUA VILA NOSSA SENHORA DA CONCEIÇAO, 67;PROX A PRAÇA SAO SEBASTIAO;Não informada;Não informado;NORTE - 2;Não;execucao;ATENDIMENTO;;
2014;06-junho;8008521514;2014-06-05;08:59;/USUARIO SOLICITA COLOCAÇÃO DE LONA EM BARREIRA COM RISCO. O MESMO PEDE URGENCIA.;NORTE;AGUA FRIA;ALTO DO PASCOAL;RUA JOASE AMARAL, 4;PROX A ESCOLA GABRIELA MISTRAL;Não informada;Não informado;NORTE - 2;Não;execucao;ATENDIMENTO;;
2014;06-junho;8008438014;2014-06-04;10:09;/USUARIA SOLICITA VISTORIA EM BARREIRA E EM CASA QUE ESTA COM RISCO DEVIDO A UM SERVICO FEITO POR UM VIZINHO. A MESMA PEDE URGENCIA.;NORTE;AGUA FRIA;ALTO DO PASCOAL;RUA LADEIRA DE PEDRA, 625;EM FRENTE A ASSOCIAÇÃO DOS SALDADOS;Não informada;Não informado;NORTE - 2;Não;execucao;ATENDIMENTO;;
2014;06-junho;8008483614;2014-06-04;15:30;VISTORIA EM IMOVEL USUARIA INF QUE A CASA ESTA COM RACHADURAS SOLICITA URGENCIA DEVIDO A UMA FOSSA QUE PASSA PELO SEU IMOVEL;PLANICIE;AGUA FRIA;AGUA FRIA;RUA JOSE MANOEL DE LIMA N°149;PROX A BARRACA DE POPO E AO TERMINAL DE AGUA FRIA PROCURAR POR JANE A FILHA DE LUCIA;Não informada;Não informado;NORTE - 2;Não;completo;ATENDIMENTO;;
2014;06-junho;8009638314;2014-06-26;14:14;USUÁRIO INFORMA QUE O TELHADO DA RESIDENCIA CAIU, A QUAL A CASA ESTA INTERDITADA, O MESMO SOLICITA UMA VISTORIA URGENTE.;PLANICIE;AGUA FRIA;ÁGUA FRIA;RUA MAJOR  PAJUABA, N°63A;PRÓXIMO  A IGREJA SANTO ANTONIO.;Não informada;Não informado;NORTE - 2;Não;completo;ATENDIMENTO;;
2014;05-maio;8008240614;2014-05-29;15:25;VISTORIA EM BARREIRA E COLOCAÇAO DE LONA SOLICITA URGENCIA POIS BARREIRA ESTA DESLIZANDO;NORTE;AGUA FRIA;ALTO DO CEU;RUA RIO IGUAIBA N°300;PROX AO MERCADINHO DE VADO;Não informada;Não informado;NORTE - 2;Não;execucao;ATENDIMENTO;;
2014;05-maio;8007656414;2014-05-16;18:01;DEFERIR VISTORIA EM BARREIRA E COLOCAÇÃO DE LONA PLÁSTICA SOBRE O TALUDE.;NORTE;AGUA FRIA;CGO. DO DEODATO;RUA QUINZE DE NOVEMBRO, 09;ATRAZ DA ESCOLA ALDA ROMEU;Não informada;Não informado;NORTE - 2;Sim;execucao;ATENDIMENTO;;
2014;05-maio;8007616214;2014-05-16;10:15;o usuario informa que a sua vizinha esta cavando a barreira fazendo uma construção irregular no local. além da construção, ela esta jogando todo o barro e metralha na escadaria, entupindo a canaleta.;NORTE;AGUA FRIA;corrego da padaria;rua fragoso, 32.;próximo ao mercadinho são rafael;Não informada;Não informado;NORTE - 2;Não;execucao;ATENDIMENTO;;
2014;05-maio;8007598414;2014-05-15;15:54;SOLICITA COLOCAÇÃO DE LONA EM BARREIRA.;NORTE;AGUA FRIA;ALTO DO PASCOAL;RUA MERCURIO, Nº 89;PROXIMO AO MERCADINHO LEMOS.;Não informada;Não informado;NORTE - 2;Não;execucao;ATENDIMENTO;;
2014;05-maio;8007556014;2014-05-14;21:53;VISTORIA EM BARREIRA, AFIRMA QUE VIZINHO TEM CANO QUE PASSA SOBRE BARREIRA, E CANO VEIO A ROMPER/SE E GERANDO INFILTRAÇÃO NA MESMA;NORTE;AGUA FRIA;ALTO DO PASCOAL;RUA SABINOPOLIS, 327;PRÓXIMO AO SALÃO PAZ E AMOR;Não informada;Não informado;NORTE - 2;Sim;execucao;ATENDIMENTO;;
2014;05-maio;8007509114;2014-05-14;10:50;/USUARIA SOLICITA VISTORIA EM CASA QUE ESTA COM A ESTRUTURA DANIFICADA E COM RISCO DE DESABAMENTO. USUARIA PEDE URGENCIA;NORTE;AGUA FRIA;BARRIGUDA;RUA BARAO DE ALAGOAS, 50;PROX A ARVORE BARRIGUDA.;Não informada;Não informado;NORTE - 2;Não;execucao;ATENDIMENTO;;
2014;05-maio;8007419214;2014-05-13;14:15;SOLICITA UMA VISTORIA NA BARREIRA;NORTE;AGUA FRIA;ALTO DO PERERINHA;RUA   GRENAL N°94;PROX AO SÓ BEBIDA ITALIANO NO ALTO PERERINHA;Não informada;Não informado;NORTE - 2;Não;execucao;ATENDIMENTO;;
2014;05-maio;8007364314;2014-05-13;09:44;USUÁRIA SOLICITA UMA VISTORIA E A COLOCAÇÃO DA LONA NO LOCAL COM URGÊNCIA , POIS, A BARREIRA ESTA DESLIZANDO.;NORTE;AGUA FRIA;ALTO O PASCOAL;RUA ELZA, 215;NO TERMINAL O ALTO O PASCOAL;Não informada;Não informado;NORTE - 2;Não;execucao;ATENDIMENTO;;
2014;05-maio;8007303414;2014-05-12;10:45;/USUARIA SOLICITA VISTORIA EM ESCADARIA QUE ESTA CEDENDO COM RISCO DE DESABAMENTO. USUARIA PEDE URGENCIA;NORTE;AGUA FRIA;CGO DO DEODATO;RUA MONTE ALEGRE;PROX A RUA DA FEIRA. NA RUA DO DEPOSITO DE BEBIDAS DE ISAAC E A MIÇANGUEIRA;Não informada;Não informado;NORTE - 2;Não;execucao;ATENDIMENTO;;
2014;05-maio;8007273814;2014-05-10;08:39;USUÁRIO INFORMA QUE UMA ESCADARIA ESTA QUEBRADA, É ÁGUA ESTA ESCORRENDO PELA BARREIRA. COM ISSO A BARREIRA ESTA DESLIZANDO. PEDE URGENCIA;NORTE;AGUA FRIA;AGUA FRIA;RUA DA JAQUEIRA N°268;PROX MERCEARIA DE JORGE;Não informada;Não informado;NORTE - 2;Não;execucao;ATENDIMENTO;;
2014;05-maio;8007254314;2014-05-09;13:26;USUÁRIA SOLICITA A VISTORIA NA BARREIRA, POIS ELA ESTÁ CAINDO E NELA HÁ UMA RESIDÊNCIA NO TOPO.;NORTE;AGUA FRIA;CÓRREGO ABUFARI;RUA ABUFARI, N° 147;PRÓXIMO AO TERMINAL DE ÔNIBUS DE ÁGUA FRIA;Não informada;Não informado;NORTE - 2;Não;execucao;ATENDIMENTO;;
2014;05-maio;8007247714;2014-05-09;11:42;USUÁRIA SOLICITA  VISTORIA EM ESCADARIA.;NORTE;AGUA FRIA;CORREGO DO DEODATO;RUA HERMES DA FONSECA;A RUA FICA EM FRENTE A IGREJA BATISTA NACIONAL DE AGUA FRIA.;Não informada;Não informado;NORTE - 2;Não;execucao;ATENDIMENTO;;
2014;05-maio;8007213514;2014-05-08;16:18;vistoria em escadaria onde degraus estao sedendo devido a infiltraçao solicita urgencia;NORTE;AGUA FRIA;CORREGO DO DEODATO;RUA HERMES DA FONSECA N°42;RUA EM FRENTE A IGREJA BATISTA NACIONAL DE AGUA FRIA;Não informada;Não informado;NORTE - 2;Não;execucao;ATENDIMENTO;;
2014;05-maio;8007166714;2014-05-08;10:39;USUÁRIA SOLICITA VISTORIA EM RESIDENCIAS, A MESMA INFORMA QUE AS CASAS JA FORAM CONDENADA, E AS MORADORAS AINDA CONTINUA RESIDINDO .;NORTE;AGUA FRIA;BARRERÃO DA RUA BELO JARDIM;RUA BELO JARDIM 350 142;UMA RUA QUE FICA EM FRENTE DO LOJÃO  DOS PRESENTES DO CENTRO DE AGUA FRIA ( MOURADORAS MARIA DAS GRAÇAS FLOREANO E MARCILENE .;Não informada;Não informado;NORTE - 2;Não;execucao;ATENDIMENTO;;
2014;07-julho;8011302914;2014-07-15;09:34;USUÁRIA SOLICITA VISTORIA EM SUA CASA, A MESMA INFORMA QUE ENTROU MUITA ÁGUA EM SEU QUINTAL (OITÃO), A QUAL PENETRA PELA PAREDE EM SEU QUARTO.(VISTORIA NA RESIDENCIA);NORTE;AGUA FRIA;ALTO DO COTO;RUA BARAO DE LUCENA, N°365;EM FRENTE AO COLÉGIO ROSA E NO OITÃO DO BOM PREÇO BOM JESUS. (LOCALIDADE ALTO DEODATO);2;2-NORTE;2.2;Não;execucao;ATENDIMENTO;;Vistoria
2014;07-julho;8011182314;2014-07-14;10:06;USUÁRIA SOLICITA VISTORIA EM TERRENO, POIS A MESMA DESEJAR CONSTRUIR UMA CASA.(VISTORIA SE TERRENO ESTA EM BOA FORMA PARA CONSTRUÇÃO).;NORTE;AGUA FRIA;CGO. DO DEODATO;RUA   ARATINGA, N°41;PRÓXIMO A IGREJA CATÓLICA DO ALTO DO PASCOAL OU APÓS A ESCOLA ALDO ROMEU.;2;2-NORTE;2.2;Não;execucao;ATENDIMENTO;;Vistoria
2014;07-julho;8011144414;2014-07-14;07:43;demandante informa que barreira esta com risco  e deseja avaliação com brevidade, porém nao ocorreu deslizamento .;NORTE;AGUA FRIA;CGO. DO DEODATO;RUA ANGICAL, Nº 283;próximo a miçangueira e proximo a escola robe magalhaes.;2;2-NORTE;2.2;Sim;execucao;ATENDIMENTO;;Vistoria
2014;07-julho;8010961914;2014-07-11;13:35;MORADOR INFORMA QUE VIZINHO ACIMA DA BARREIRA, FEZ UMA CONSTRUÇÃO IRREGULAR NA BEIRA DA BARREIRA, COLOCANDO EM RISCO DESLIZAMENTO. PEDE VISTORIA COM URGENCIA.;NORTE;AGUA FRIA;CGO. DO DEODATO;RUA ANGICAL, Nº 283;RUA DA FEIRA. EM FRENTE A MISSANGUEIRA.;2;2-NORTE;2.2;Não;execucao;ATENDIMENTO;;Vistoria
2014;07-julho;8010901614;2014-07-10;16:33;USUARIO SOLICITA UMA VISTORIA EM UM TERRENO CONDENADO PELA SEDEC ONDE ESTA SERVINDO DE PONTO DE DROGAS O MESMO INF QUE JA SOLICITOU A PRESENÇA DA POLICIA POREM NAO OBTEVE RETORNO;NORTE;AGUA FRIA;CGO. SAO SEBASTIAO;rUA IDEAL S/N;PROX AO TERMINAL DE ONIBUS DE AGUA FRIA;2;2-NORTE;2.2;Não;execucao;ATENDIMENTO;;Vistoria
2014;07-julho;8010722414;2014-07-09;10:05;USUÁRIA SOLICITA VISTORIA COM URGENCIA.;NORTE;AGUA FRIA;CGO. DO DEODATO;RUA RUA CORREGO DO DEODATO N 33;NO TERMINAL DAS VANS.;2;2-NORTE;2.2;Não;execucao;ATENDIMENTO;;Vistoria
2014;07-julho;8010537214;2014-07-07;06:00;SR OSVALDO INFORMA QUE A CAIXA D'AGUA CAIU E ESTA COMPROMETENDO CA ESTRUTURA DA CASA.CONTATO: 88123500;NORTE;AGUA FRIA;CGO. SAO SEBASTIAO;RUA SAO RAFAEL;PROX AO PASTEL DO BOLINHO;2;2-NORTE;2.2;Sim;execucao;ATENDIMENTO;;Vistoria
2014;06-junho;8009472814;2014-06-26;09:42;USUÁRIA SOLICITA VISTORIA EM BARREIRA POIS A MESMA CEDEU UMA PARTE COM AS ÚLTIMAS CHUVAS, COM RISCO DE DESLIZAR MAIS BARRO POR SOBRE AS CASA. ATENDER COM URGÊNCIA.;NORTE;AGUA FRIA;CÓRREGO SÃO JOSÉ;RUA SÃO JOSÉ N. 231  ÁGUA FRIA;PRÓX. AO BAR DE BIU.;Não informada;Não informado;;Não;execucao;ATENDIMENTO;;
2014;05-maio;8008173714;2014-05-29;10:51;SOLICITA VISTORIA EM BARREIRA COM RISCO DE DESLIZAMENTO. JÁ FOI FEITO CONTATO COM GEORGE DA REGIONAL.;NORTE;AGUA FRIA;CORREGO DA PADARIA;RUA PETROVINA, Nº132;PRÓX A BARRACA DE GILSON E DA ASSEMBLEIA DE DEUS.;Não informada;Não informado;NORTE - 2;Não;execucao;ATENDIMENTO;;
2014;05-maio;8007034314;2014-05-06;13:31;RECOLOCAÇAO DE LONA COM URGENCIA;NORTE;AGUA FRIA;ALTO DO PASCOAL;RUA SEVERINO CARNEIRO N° 69;PROX AO ANTIGO PORTUARIO;Não informada;Não informado;NORTE - 2;Não;execucao;ATENDIMENTO;;
2014;05-maio;8006985414;2014-05-05;15:22;VISTORIA EM MURO DE ARIMO USUARIA INF QUE PEDRAS ESTAO SE DESLOCANDO E TEME ACIDENTES SOLICITA URGENCIA;NORTE;AGUA FRIA;ALTO DO COTO;Rua Pastor Evangélico Benoby Carvalho de Souza N°520;CONTATO/86182615  PROX A LIGA DE DOMINOR LAR BRASILEIRO;Não informada;Não informado;NORTE - 2;Não;execucao;ATENDIMENTO;;
2014;05-maio;8008164814;2014-05-29;10:19;CAIU PARTE DO MURO DE ARRIMO. JÁ FOI FEITO CONTATO COM GEORGE DA REGIONAL.;NORTE;AGUA FRIA;AGUA FRIA;RUA URANIA Nº30;PRÓXIMO AO ARMAZÉM DORNELAS;Não informada;Não informado;NORTE - 2;Não;execucao;ATENDIMENTO;;
2014;05-maio;8008159414;2014-05-29;10:09;O MESMO INFORMA QUE A BARREIRA DESABOU ONTEM A NOITE. JÁ FOI FEITO CONTATO COM GEORGE DA REGIONAL.;NORTE;AGUA FRIA;AGUA FRIA;RUA PASTOR BEMOBI Nº1754;NÃO INFORMADO;Não informada;Não informado;NORTE - 2;Não;execucao;ATENDIMENTO;;
2014;05-maio;8008156514;2014-05-29;10:04;BARREIRA POR TRÁS DA CASA CAIU, BARRO COLADO NA PAREDE, SEM VITIMAS. JÁ FOI FEITO CONTATO COM GEORGE DA REGIONAL.;NORTE;AGUA FRIA;CORREGO JOÃO CARVOEIRO;RUA CORREGO JOÃO CAVOEIRO Nº226;PRÓXIMO AO TERMINAL DE ÁGUA FRIA;Não informada;Não informado;NORTE - 2;Não;execucao;ATENDIMENTO;;
2014;05-maio;8008148214;2014-05-29;09:39;VISTORIA EM BARREIRA QUE ESTA COM RISCO DE DESLIZAMENTO. USUARIO PEDE URGENCIA.;NORTE;AGUA FRIA;CGO DA PADARIA;RUA PETROVINA, Nº 132;PROX A BARRACA DE GILSON  E A ASSEMBLEIA DE DEUS.;Não informada;Não informado;NORTE - 2;Não;execucao;ATENDIMENTO;;
2014;05-maio;8008097914;2014-05-28;09:28;USUÁRIO SOLICITA  VISTORIA NA RESIDENCIA DO MESMO, INFORMA QUE A GALERIA ESTA DANIFICANDO A PAREDE DA CASA. PEDE URGÊNCIA.;NORTE;AGUA FRIA;RUA RAMIRO MACEDO;RUA RAMIRO MACEDO N 25;PROX: A JUNIOR BEBIDAS.;Não informada;Não informado;NORTE - 2;Não;execucao;ATENDIMENTO;;
2014;05-maio;8006870214;2014-05-03;06:55;usuario solicita vistoria pois barreira com risco de deslizamento e aum poste sobre a barreira.;NORTE;AGUA FRIA;corrego são jose;RUA SÃO JOSE 231;PROX AO DEPOSITO DO DINHO;Não informada;Não informado;NORTE - 2;Sim;execucao;ATENDIMENTO;;
2014;05-maio;8006832314;2014-05-02;17:21;DESLIZAMENTO DE BARREIRAS USUARIO SOLICITA VISITA TECNICA COM URGENCIA;NORTE;AGUA FRIA;CORREGO DO DEODATO;rua epitafio pessoa n°126;AO LADO DA ASSEMBLEIA DE DEUS DO CORREGO DO DEODATO;Não informada;Não informado;NORTE - 2;Sim;execucao;ATENDIMENTO;;
2014;05-maio;8006820514;2014-05-02;16:29;vistoria EM IMOVEL COM RACHADURAS TEME ACIDENTES URGENCIA;NORTE;AGUA FRIA;corrego DO DEODATO;rua alto cobaça n°37;2° entrada apos a igreja batista do corrego DO DEODATO;Não informada;Não informado;NORTE - 2;Não;execucao;ATENDIMENTO;;
2014;05-maio;8006817414;2014-05-02;16:23;queda de muro de arimo vistoria  em barreira com urgencia sem vitimas;NORTE;AGUA FRIA;corrego do deodato;rua aucobaça n°38;contato/88361951 a 2° entrada apos a igreja batista do corrego;Não informada;Não informado;NORTE - 2;Não;execucao;ATENDIMENTO;;
2014;05-maio;8006803314;2014-05-02;15:26;RECOLOCAÇAO DE LONA COM URGENCIA;NORTE;AGUA FRIA;corrego sao sebastiao;rua jose manoel de lima n°136;prox ao terminal de onibus do corrego sao sebastiao;Não informada;Não informado;NORTE - 2;Não;execucao;ATENDIMENTO;;
2014;05-maio;8006714014;2014-05-02;08:11;USUARIA DESEJA BREVIDADE EM REPOSIÇÃO DE LONA.;NORTE;AGUA FRIA;CGO DO TIRO;RUA CURUTAI, 22;PRÓXIMO AO ANTIGO BAR DO PEDRINHO;Não informada;Não informado;NORTE - 2;Não;execucao;ATENDIMENTO;;
2014;04-abril;8005043514;2014-04-04;10:38;usuaria solicita uma vistoria na residencia pois a sua casa esta com vazamento no teto.;NORTE;AGUA FRIA;alto bela vista;rua benevolo, 760;proximo ao clube bela vista e a lojinha de bia.;Não informada;Não informado;NORTE - 2;Não;execucao;ATENDIMENTO;;
2014;04-abril;8006680914;2014-04-30;20:36;DESLIZAMENTO DE BARREIRA, CASAS EM CIMA E EM BAIXO, RISCO DE NOVO DESLIZAMENTO NO RESTO DA NOITE;NORTE;AGUA FRIA;CORREGO DO DEODATO;TRV EPITASSIO PESSOA, 123;ENTRA PELA RUA CORREGO DO DEODATO, RUA AO LADO DA ASSEMBLEIA DE DEUS.;Não informada;Não informado;NORTE - 2;Sim;execucao;ATENDIMENTO;;
2014;04-abril;8006675514;2014-04-30;17:06;COLOCAÇAO DE LONA COM URGENCIA;NORTE;AGUA FRIA;CORREGO DO DEODATO;RUA ALTOLANDIA N°22;PROX A  CLINICA DENTARIA DE SIRGIMUNDO LUIZ;Não informada;Não informado;NORTE - 2;Sim;execucao;ATENDIMENTO;;
2014;04-abril;8006670314;2014-04-30;16:31;QUEDA DE BARREIRA DEVIDO A UMA OBRA DA PREFREITURA FOI CAVADA A BASE PARA FAZER O MURO DO ARIMO E NAO RETOMARAM AO LOCAL BARREIRA SEDEU URGENTE;NORTE;AGUA FRIA;CORREGO DO DEODATO;RUA TRAVESSA EFICACIO PESSOA N°121;PROX A IGREJA ASSEMBLEIA DE DEUS;Não informada;Não informado;NORTE - 2;Não;execucao;ATENDIMENTO;;
2014;04-abril;8006496314;2014-04-30;09:33;DEMANDANTE SOLICITA REPOSIÇÃO DE LONA COM URGÊNCIA;NORTE;AGUA FRIA;ALTO DO PASCOAL;RUA LUIZ CORREIA, N 37;PROXIMO AO BAR DA AMANDA;Não informada;Não informado;NORTE - 2;Não;execucao;ATENDIMENTO;;
2014;04-abril;8006478514;2014-04-30;08:32;USUÁRIA SOLICITA VISTORIA EM BARREIRA E COLOCAÇÃO DE LONA. URGENTE.;NORTE;AGUA FRIA;CÓRREGO DO DEODATO;RUA SANTA FÉ  N. 27;NO FINAL DO CÓR. DO DEODATO E PRÓX. A ESCOLA DA PREFEITURA.;Não informada;Não informado;NORTE - 2;Não;execucao;ATENDIMENTO;;
2014;04-abril;8006465014;2014-04-30;07:59;USUÁRIO SOLICITA VISTORIA EM BARREIRA E COLOCAÇÃO DE LONA. URGENTE.;NORTE;AGUA FRIA;CÓRREGO DO DEODATO;RUA JOSEFA GOMES  N. 50;APÓS A ASSEMBLÉIA DE DEUS DO CÓRREGO DO DEODATO (NA ESCADARIA). RUA TAMBÉM CONHECIDA POR SEVERINA GOMES.;Não informada;Não informado;NORTE - 2;Não;execucao;ATENDIMENTO;;
2014;04-abril;8006464414;2014-04-30;07:52;USUÁRIA DESEJA BREVIDADE EM REPOSIÇÃO DE LONA;NORTE;AGUA FRIA;ALTO SANTA TEREZINHA;RUA IGUAIBA Nº 218;NA RUA DA ANTIGA CARVOARIA;Não informada;Não informado;NORTE - 2;Não;execucao;ATENDIMENTO;;
2014;04-abril;8005386014;2014-04-09;17:24;VISTORIA EM MURO E ARIMO USUARIA INF QUE MURO ESTA COM VAZAMENTO SOLICITA URGENCIA POIS TEME ACIDENTES NO LOCAL;NORTE;AGUA FRIA;CORREGO  DO DEODATO;RUA AUTOLANIA N°291;PROX A IGREJA BATISTA E AO MERCADINHO SAO RAFAEL;Não informada;Não informado;NORTE - 2;Sim;execucao;ATENDIMENTO;;
2014;04-abril;8005329614;2014-04-08;12:50;USUARIO SOLICITA UMA VISTORIA EM BARREIRA, PEDE REPOSICAO DE LONA.;NORTE;AGUA FRIA;CORREGO SAO FRANCISCO;RUA  ATALANTA;AV BOMBA DO HEMETERIO NA RUA DA FARMACIA NOVA JERUZALEM, NO CORREGO SAO FRANCISCO PROX CAPELA SAO FRANCISCO.;Não informada;Não informado;NORTE - 2;Não;execucao;ATENDIMENTO;;
2014;04-abril;8006376814;2014-04-29;11:00;USUARIO INFORMA QUE FOI CONSTRUIDO UMA CALHA DE UM COLEGIO CAINDO PARA A BARREIRA CAUSANDO RISCO. PEDE BREVIDADE NA AVALAIÇÃO;NORTE;AGUA FRIA;ALTO DO POSCOAL;RUA SEVERINO CARNEIRO Nº 129;PROXIMO AO ARMAZEM DORNELAS;Não informada;Não informado;NORTE - 2;Não;execucao;ATENDIMENTO;;
2014;04-abril;8005465714;2014-04-10;21:44;ERRADICAÇAO DE UM PÉ DE MANGA COM CUPIM, GRANDE PORTE.ARVORE ESTA PENDENDO PRA O LADO DA RESIDÊNCIA DO MESMO.;NORTE;AGUA FRIA;CORREGO DO DEODATO;RUA HERNES DA FONSECA N 36;EM FRENTE A IGREJA BATISTA NACIONAL.;Não informada;Não informado;NORTE - 2;Sim;execucao;ATENDIMENTO;;
2014;04-abril;8006298714;2014-04-28;11:56;SOLICITA COLOCAÇÃO DE LONA.;NORTE;AGUA FRIA;CÓRREGO0 DO DEODATO;RUA TEODORO DA FONSECA  N. 61;APÓS A ASSEMBLÉIA DE DEUS E A PONTE, 2 ENTRADA A DIREITA DE QUEM VEM DE AGUA FRIA.;Não informada;Não informado;NORTE - 2;Não;execucao;ATENDIMENTO;;
2014;04-abril;8006204214;2014-04-25;09:53;usuária solicita a reposição da lona no local. urgência.;NORTE;AGUA FRIA;alto do pascoal;rua ladeira de pedra, 1204.;após o mercadinho lemos e escola Gabriela mistral.;Não informada;Não informado;NORTE - 2;Não;execucao;ATENDIMENTO;;
2014;04-abril;8006111414;2014-04-23;16:14;VISTORIA EM BARREIRA DEVIDO A UMA CONSTRUÇAO INRREGULAR DA SUA VIZINHA O MESMO INF QUE ESTA ESCULTANDO ESTALOS NA BARREIRA SOLICITA  URGENTE TEME ACIDENTES;NORTE;AGUA FRIA;CORREGO DO DEODATO;RUA  Anitópolis;CONTATO/85814316 PROX SO POSTO DE SAUDE TIA REGINA;Não informada;Não informado;NORTE - 2;Não;execucao;ATENDIMENTO;;
2014;04-abril;8006004314;2014-04-23;08:48;usuária informa que o cano da Compesa esta quebrado e a água esta danificando a escadaria. uma parte já cedeu e a residencia da solicitante esta com risco. urgência.;NORTE;AGUA FRIA;AGUA FRIA;rua urania, 79;no terminal de onibus beberibe/ afogados;Não informada;Não informado;NORTE - 2;Não;execucao;ATENDIMENTO;;
2014;03-marco;8004432814;2014-03-22;11:02;/USUARIO SOLICITA VISTORIA EM BARREIRA COM RISCO DEVIDO A INFILTRAÇAO. O MESMO PEDE URGENCIA.;NORTE;AGUA FRIA;ALTO DO PASCOAL;RUA SEVERINO CARNEIRO.129;PROX AO ARMAZEM DORNELAS.;Não informada;Não informado;NORTE - 2;Sim;execucao;ATENDIMENTO;;
2014;03-marco;8003430114;2014-03-11;15:11;USUARIO SOLICITA UM COLOCAÇAO DE LONA, O MAIS RAPIDO POSSIVEL;NORTE;AGUA FRIA;CORREGO DEODATO;RUA ALMIRANTE BARROSO  N°533;PROX AO MERCADINHO SAO RAFAEL (RUA DA FEIRA);Não informada;Não informado;NORTE - 2;Não;execucao;ATENDIMENTO;;
2014;03-marco;8003663614;2014-03-13;15:07;DEFERIR COLOCACAO DE LP // URGENTE;NORTE;AGUA FRIA;CGO. DO DEODATO;RUA ALTOLANDIA, 22;FICA NA 1ª ESCADARIA, LADO DIREITO, PARA QUEM ENTRA NO CGO. (PROX A VENDA DE RAL);Não informada;Não informado;NORTE - 2;Não;execucao;ATENDIMENTO;;
2014;03-marco;8003614514;2014-03-13;11:07;O USUARIO INFORMA QUE NA PRIMEIRA TRV PITA, N°125, UM CIDADÃO CHAMADO LUCAS, FEZ UMA CONSTRUÇÃO IRREGULAR POR CIMA DA CASA DDELE E O O RECLAMANTE JA FEZ A DENUNCIA MAS A DEFESA CIVIL AINDA NAO DEU A ORDEM E NENHUMA POSIÇÃO. USUARIO SOLICIT6A UMA NOVA VISTORIA.;NORTE;AGUA FRIA;ALTO DO PASCOAL;RUA TRINTA E SETE, 136;PROXIMO A ESCOLA GABRIELA MISTRAL;Não informada;Não informado;NORTE - 2;Não;execucao;ATENDIMENTO;;
