ano;mes;processo_numero;solicitacao_data;solicitacao_hora;solicitacao_descricao;solicitacao_regional;solicitacao_bairro;solicitacao_localidade;solicitacao_endereco;solicitacao_roteiro;rpa_codigo;rpa_nome;solicitacao_microrregiao;solicitacao_plantao;processo_situacao;processo_tipo;processo_origem;processo_solicitacao
2016;08-agosto;8046976216;2016-08-01;10:28;TESTE SOLICITADO POR SUPERVISORA RENATA MARIA.;PLANICIE;AFLITOS;AFLITOS;RUA 01;TESTE.;3;3-NOROESTE;3.1;Não;completo;ATENDIMENTO;;Colocacao de Lonas Plasticas
2016;08-agosto;8046976216;2016-08-01;10:28;TESTE SOLICITADO POR SUPERVISORA RENATA MARIA.;PLANICIE;AFLITOS;AFLITOS;RUA 01;TESTE.;3;3-NOROESTE;3.1;Não;completo;ATENDIMENTO;;Vistoria
2016;05-maio;8021489016;2016-05-02;18:00;teste;PLANICIE;AFLITOS;AFLITOS;teste;teste;3;3-NOROESTE;3.1;Sim;completo;ATENDIMENTO;;Vistoria
2016;04-abril;8018956016;2016-04-19;18:22;texte;PLANICIE;AFLITOS;AFLITOS;vdvfsdhjfklas;dercfed;3;3-NOROESTE;3.1;Sim;completo;ATENDIMENTO;;Vistoria
2016;04-abril;8018516016;2016-04-18;17:08;teste;PLANICIE;AFLITOS;AFLITOS;teste;teste;3;3-NOROESTE;3.1;Sim;completo;ATENDIMENTO;;Colocacao de Lonas Plasticas
2016;04-abril;8017416216;2016-04-16;08:49;edf. Montenegro esta rachado e  pode cair, uma parte do muro já caiu e está impedindo o acesso de dentro do prédio para moradores e carros.;PLANICIE;AFLITOS;AFLITOS;av. santos dumont;prox ao campo do nautico, primeira a direita.;3;3-NOROESTE;3.1;Sim;completo;ATENDIMENTO;;Vistoria
2016;01-janeiro;8003598616;2016-01-29;16:33;USUÁRIO INFORMA A QUEDA DE UMA ARVORE E SOLICITA URGENCIA;PLANICIE;AFLITOS;AFLITOS;RUA MALAQUIAS;PRÓXIMO AO BANCO ITAU;3;3-NOROESTE;3.1;Sim;completo;ATENDIMENTO;;Vistoria
2015;12-dezembro;8038244815;2015-12-15;09:51;USUÁRIA SOLICITA VISTORIA NA CAIXA D´ÁGUA DO ED. DO BLOCO B. A MESMA INFORMA QUE A CAIXA ESTA COM (RACHADURAS E VAZAMENTOS). A QUAL ESTA TRAZENDO RISCOS PARA OS MORADORES.;PLANICIE;AFLITOS;AFLITOS;AV. ROSA E SILVA, N 257.;PRÓXIMO AO CLUBE PORTUGUÊS.;3;3-NOROESTE;3.1;Não;completo;ATENDIMENTO;;Vistoria
2015;12-dezembro;8037555015;2015-12-07;14:18;teste;PLANICIE;AFLITOS;AFLITOS;teste;teste;3;3-NOROESTE;3.1;Não;completo;ATENDIMENTO;;Vistoria
2015;09-setembro;8028708115;2015-09-15;11:51;usuário informa que um vizinho esta fazendo um serviço no prédio , quebrando a parede , pede urgência de uma fiscalização;PLANICIE;AFLITOS;AFLITOS;RUA   CARNEIRO VILELA n 343;edifício jaraguá (galeria esquina 48 pega a direita edifício branco);3;3-NOROESTE;3.1;Não;completo;ATENDIMENTO;;Vistoria
2015;08-agosto;8027096215;2015-08-28;11:13;teste;PLANICIE;AFLITOS;AFLITOS;marques de olinda;teste;3;3-NOROESTE;3.1;Não;completo;ATENDIMENTO;;Vistoria
2015;08-agosto;8027226315;2015-08-31;10:54;TESTE;PLANICIE;AFLITOS;;TESTE;TESTE;3;3-NOROESTE;3.1;Não;completo;ATENDIMENTO;;Vistoria
2015;08-agosto;8026912015;2015-08-26;17:37;TESTE;PLANICIE;AFLITOS;AFLITOS;RUA MARQUES DE OLINDA;TESTE;3;3-NOROESTE;3.1;Sim;completo;ATENDIMENTO;;Vistoria
2015;01-janeiro;8001316515;2015-01-14;15:05;USUÁRIO SOLICITA VISTORIA DE IMÓVEL, INFORMA QUE UM PEDAÇO DA VARANDO DO EDIFÍCIO DESABOU DO 10° ANDAR, O MESMO NÃO CAIU EM CIMA DE NENHUM CIDADÃO, SOLICITA URGÊNCIA.;PLANICIE;AFLITOS;AFLITOS;RUA DO FUTURO, N°897;PROX. AO PARQUE DA JAQUEIRAAO LADO DO CLUBE ABB;3;3-NOROESTE;3.1;Não;completo;ATENDIMENTO;;Vistoria
2014;10-outubro;8017835914;2014-10-13;15:52;teste;PLANICIE;AFLITOS;AFLITOS;00000;teste;3;3-NOROESTE;3.1;Não;completo;ATENDIMENTO;;Colocacao de Lonas Plasticas
2014;09-setembro;8016504914;2014-09-24;07:22;A USUÁRIA INFORMA QUE O PRÉDIO ESTAR COM RACHADURAS E CAINDO OS PEDAÇOS E COM FERROS EXPOSTO E COM FILTRAÇÃO DE ÁGUA.....;PLANICIE;AFLITOS;AFLITOS;AV SANTOS DOMON Nº455;O PRÉDIO FICA EM FRENTE PADARIA PÃO DE FORNO;3;3-NOROESTE;3.1;Sim;completo;ATENDIMENTO;;Vistoria
2014;08-agosto;8013839014;2014-08-25;09:03;CIDADÃO SOLICITA VISTORIA EM COBERTA DE ESTABELECIMENTO COMERCIAL ( ASS. TECNICA DE COMPUTADORES E TELEVISÃO), POIS INFORMA QUE 2 VIGAS DESTA COBERTURA ESTÃO ROMPIDAS CAUSANDO RISCO AOS PEDESTRES QUE PASSAM EM ABAXO DA MESMA.;PLANICIE;AFLITOS;AFLITOS;AV. ROSA E SILVA, Nº 1414;APÓS O CRUZAMENTO DA ROSA E SILVA  COM  SANTOS DO DUMONT, AO LADO DIREITO.;3;3-NOROESTE;3.1;Não;completo;ATENDIMENTO;;Vistoria
2014;08-agosto;8012453014;2014-08-01;14:51;Cancelar protocolo.Abimael.;PLANICIE;AFLITOS;AFLITOS;aaaa;aaaa;3;3-NOROESTE;3.1;Não;execucao;ATENDIMENTO;;Rocagem
2014;07-julho;8012391514;2014-07-31;17:54;Chamado teste. Por favor, cancelar este chamado!;PLANICIE;AFLITOS;AFLITOS;rua abc;Chamado teste. Por favor, cancelar este chamado!;3;3-NOROESTE;3.1;Não;completo;ATENDIMENTO;;Monitoramento
2014;07-julho;8012391514;2014-07-31;17:54;Chamado teste. Por favor, cancelar este chamado!;PLANICIE;AFLITOS;AFLITOS;rua abc;Chamado teste. Por favor, cancelar este chamado!;3;3-NOROESTE;3.1;Não;completo;ATENDIMENTO;;Vistoria
2012;06-junho;8004255212;2012-06-20;10:34;O USUARIO PEDE  A VISTORIA DO PREDIO DE PRIMEIRO ANDAR POIS ESTÃO DEMOLIDO O FUNCIONARIO NÃO QUIZ SE IDENTIFICAR PEDE COM URGENCIA;GART;AFLITOS;AFLITOS;AV.ROSA E SILVA/N/1356;FICA NA EMPRESA M E G,FICA APOS O ESTADIO DOS AFLITOS,FICA  DE ESQUINA AO SEGUNDO SEMAFORO.;Não informada;Não informado;;Não;completo;ATENDIMENTO;;
2013;06-junho;8007250013;2013-06-06;12:06;VISTORIA NO PREDIO DA VESTI ROUGE NA PARTE DE ONDE OS FUNCIONARIOS TRABALHAM JA FOI ESCULTADO ESTALOS E O GESSO ESTA DANIFICANDO COM RISCO EMINENTE DE QUEDA  COM UM UNICO ANDAR DEVIDOS A PROBLEMAS ESTRUTURAIS COM URGENCIA;PLANICIE;AFLITOS;AFLITOS;RUA:AV CONSELHEIRO ROSA E SILVA N°403;NA LOJA VESTI ROUGE;Não informada;Não informado;NOROESTE - 1;Não;completo;ATENDIMENTO;;
2013;02-fevereiro;8001965713;2013-02-25;10:35;USUARIO SOLICITA UMA VISTORIA EM PREDIO QUE ESTA COM RISCO DEVIDO A UMA CONSTRUÇAO DE FEITA POR UM VIZINHO. A MESMA INF QUE O REBOCO DE UM DOS COMODOS DO DE SEU APTO CAIU E QUE ESTA APRESENTANDO RACHADURAS NA ESCADA. USUARIO PEDE URGENCIA!;GART;AFLITOS;AFLITOS;AV ROSA E SILVA, 1144 APTO 204 EDIFICIO SAO LUCAS;JUNTO CLUB DO NAUTICO UM PREDIO AZUL E BRANCO.;Não informada;Não informado;NOROESTE - 1;Não;completo;ATENDIMENTO;;
2012;11-novembro;8008209512;2012-11-01;10:46;teste;NORTE;AFLITOS;teste;teste;teste;Não informada;Não informado;NOROESTE - 1;Não;completo;ATENDIMENTO;;
2016;07-julho;8042142016;2016-07-11;09:22;USUARIA PEDE URGENCIA POIS SUA RESIDENCIA ESTA COM RACHADURAS.;PLANICIE;AFOGADOS;AFOGADOS;RUA SANTO CRISTO, 78 A;AO LADO DA ANTIGA CASA DAS CRIANÇAS;5;5-SUDOESTE;5.1;Não;completo;ATENDIMENTO;;Vistoria
2016;07-julho;8042448116;2016-07-12;08:23;USUÁRIO INFORMA QUE VIZINHA ESTA CONSTRUINDO DE FORMA IRREGULAR UMA CONSTRUÇÃO TODA MAL FEITA COM RISCO DE DESABAMEMTO DO PRIMEIRO ANDAR, JA FOI FEITO UM PARECER PELA DIRCON DE TODA FORMA O MESMO DESEJA UMA VISTORIA PARA SABER O NIVEL DE GRAVEDIDADE.;PLANICIE;AFOGADOS;AFOGADOS;RUA PINHORÃO, 132;TRANSVERSAL DA ESTRADA DOS REMEDIOS E ESQUINA COM A OFICINA CORSEL;5;5-SUDOESTE;5.1;Não;completo;ATENDIMENTO;;Vistoria
2016;07-julho;8044541916;2016-07-19;19:16;o usuario informa que devido as fortes chuvas e ventania foi arrancando os telhados de sua casa,favor verificar.o mesmo pede a vistoria na residencia e informa que está entrando muito agua no interior dela.;PLANICIE;AFOGADOS;AFOGADOS;RUA   FELIX PEIXOTO;perto do motel lemon.;5;5-SUDOESTE;5.1;Sim;completo;ATENDIMENTO;;Vistoria
2016;07-julho;8044682116;2016-07-20;12:04;USUÁRIA SOLICITA VISTORIA EM EDF. 1480 (TIPO CAIXÃO) QUE ESTÁ COM ESTRUTURA DANIFICADA PAREDES E BASE DO PRÉDIO COM RISCO AOS MORADORES, URGENTE.;PLANICIE;AFOGADOS;AFOGADOS;RUA VINTE E UM DE ABRIL  N. 1480;ANTES DE SAN MARTIN. APÓS O SINAL QUE CRUZA A MUSTARDINHA DA MANGUEIRA.;5;5-SUDOESTE;5.1;Não;completo;ATENDIMENTO;;Vistoria
2016;05-maio;8024969316;2016-05-12;10:14;USUÁRIA SOLICITA FISTORIA NO PREDIO CAIXÃO, CONHECIDO COMO PALANÇA MAIS NÃO CAI.INFORMA QUE ESTA COM VARIAS RACAHADURAS  JA CAIU O TETO DE VARIOS APT, E COM INFILTRAÇOES A MESMA JA SAIU DO LOCAL COM MEDO MAIS TEM VARIOS MORADORES NO EDF AINDA , A MESMA ESTA COM QUE ACONTEÇA ALGO PIOR PEDE URGÊNCIA.;PLANICIE;AFOGADOS;AFOGADOS;RUA ESTRADA DOS REMEDIO N, 1059;APOS O CABLOQUINHO, AO LADO DO FARMA PAULA.;5;5-SUDOESTE;5.1;Não;completo;ATENDIMENTO;;Vistoria
2016;05-maio;8021637016;2016-05-03;11:30;usuaria deseja a vistoria em seu imovel pois esta com rachaduras internas e externas.favor verificar.;PLANICIE;AFOGADOS;AFOGADOS;rua lajedao;proximo a antiga casa das crianças e antiga fabrica souza luna.;5;5-SUDOESTE;5.1;Não;completo;ATENDIMENTO;;Vistoria
2016;05-maio;8028121916;2016-05-21;08:20;VISTORIA EM IMOVEL POIS ESTÁ COM DIVERSAS RACHADURAS, USUARIA RELATA QUE É DEVIDO A FABRICA ORTHO PAUHER.;PLANICIE;AFOGADOS;AFOGADOS;RUA SANTO CRISTO, N  78 A;PRÓXIMO A SOUZA LUNA, FABRICA ORTHO PAUHER;5;5-SUDOESTE;5.1;Sim;completo;ATENDIMENTO;;Vistoria
2016;04-abril;8016758716;2016-04-14;07:55;USUARIA SOLICITA UMA VISTORIA POIS O ALANBRADO DE JANELA CAIU DURANTE A NOITE DE ONTEM APROXIMADAMENTE AS 08: 30 DO DIA 13/04/16 POSSUI RISCO DE DESLIZAR MAIS NO LOCAL E SOLICIT URGENCIA E NÃO POSSUI VITIMA;PLANICIE;AFOGADOS;AFOGADOS;RUA ESTRADA DOS REMEDIOS, 29;EM FRENTE A LOJA DEMETRIUS CALÇADOS SENTIDO CIDADE/ SUBURBIO;5;5-SUDOESTE;5.1;Sim;completo;ATENDIMENTO;;Vistoria
2016;01-janeiro;8003856516;2016-01-30;13:18;USUÁRIO SOLICITA  VISTORIA EM ARVORE;PLANICIE;AFOGADOS;AFOGADOS;RUA GENERAL CARLOS LIRA N, 196;AO LADO DA MATERNIDADE BANDEIRA FILHO;5;5-SUDOESTE;5.1;Sim;completo;ATENDIMENTO;;Vistoria
2016;01-janeiro;8003606916;2016-01-29;16:44;USUÁRIO INFORMA QUE ARVORE CAIU E SOLICITA URGÊNCIA;PLANICIE;AFOGADOS;AFOGADOS;RUA AMARO DUARTE N,75;AO LADO DA ESTAÇÃO IPIRANGA;5;5-SUDOESTE;5.1;Sim;completo;ATENDIMENTO;;Vistoria
2016;01-janeiro;8001062116;2016-01-12;08:33;USUARIO INFORMA QUE MURO DA RESIDENCIA DELE ESTA COM RISCO E PEDE ANALISE;PLANICIE;AFOGADOS;AFOGADOS;rua ARMANDO BURLE 394;POR TRAS DO CLUBE SARGENTO GOLF E A UMA CAPELA;5;5-SUDOESTE;5.1;Não;execucao;ATENDIMENTO;;Vistoria
2015;11-novembro;8034920915;2015-11-13;03:16;SARGENTO REGINALDO INFORMOU QUE TEVE UM INCÊNDIO NO LOCAL ONDE DEIXOU A ESTRUTURA DANIFICADA, A EQUIPE DO CORPO DE BOMBEIROS PEDE O COMPARECIMENTO DA DEFESA CIVIL.;PLANICIE;AFOGADOS;AFOGADOS;ESTRADA DOS REMÉDIOS, N 1547;EM FRENTE AO POSTO BR E APÓS O BAR DO CABOCLINHO.;5;5-SUDOESTE;5.1;Sim;completo;ATENDIMENTO;;Vistoria
2015;08-agosto;8025349015;2015-08-12;14:16;a usuaria informa que no local esta sendo feito uma construção irregular.favor verificar com urgencia.;PLANICIE;AFOGADOS;AFOGADOS;RUA   TURIACU;vindo pela rua são miguel entrar pela igreja da fé seguindo em frente segunda entrada a direita.;5;5-SUDOESTE;5.1;Não;completo;ATENDIMENTO;;Vistoria
2015;08-agosto;8025351515;2015-08-12;14:16;a usuaria informa que no local esta sendo feito uma construção irregular.favor verificar com urgencia.;PLANICIE;AFOGADOS;AFOGADOS;RUA   TURIACU;vindo pela rua são miguel entrar pela igreja da fé seguindo em frente segunda entrada a direita.;5;5-SUDOESTE;5.1;Não;completo;ATENDIMENTO;;Vistoria
2015;07-julho;8022875315;2015-07-24;18:30;a usuaria informa que o vizinho esta fazendo uma construção irregular ao lado de sua residencia,favor verificar com urgência.;PLANICIE;AFOGADOS;AFOGADOS;RUA   TURIACU;vindo rua sao miguel entrada pela igreja da sé segue em frente a segunda rua a direita.;5;5-SUDOESTE;5.1;Sim;completo;ATENDIMENTO;;Vistoria
2015;07-julho;8023308515;2015-07-28;17:14;SOLICITANTE INFORMA QUE CASA É BASTANTE ANTIGA, E ESTÁ MUITO DETERIORADA DEVIDO AO ABANDONO DE CUIDADOS DO MORADOR ANTERIOR. DIZ QUE CASA É DO PAI FALECIDO, MAS QUE AGORA ESTÁ COM RISCO DE DESABAMENTO. PEDE VISTORIA PARA IDENTIFICAR POSSIVEL RISCO, PARA ASSIM TOMAR AS PROVIDENCIAS PARA MORADIA.;PLANICIE;AFOGADOS;AFOGADOS;RUA MARIAPOLIS, Nº 202;PELA RUA SAO MIGUEL. APOS DO COLEGIO AMAURY DE MEDEIROS. ANTES DA IGREJA BATISTA.FONE: 8887/5130 (ROSAL);5;5-SUDOESTE;5.1;Sim;completo;ATENDIMENTO;;Vistoria
2015;07-julho;8022873015;2015-07-24;18:30;a usuaria informa que o vizinho esta fazendo uma construção irregular ao lado de sua residencia,favor verificar com urgência.;PLANICIE;AFOGADOS;AFOGADOS;RUA   TURIACU;vindo rua sao miguel entrada pela igreja da sé segue em frente a segunda rua a direita.;5;5-SUDOESTE;5.1;Sim;completo;ATENDIMENTO;;Vistoria
2015;06-junho;8015934815;2015-06-02;12:33;USUÁRIO SOLICITA VISTORIA EM IMOVEL, INFORMA QUE NO SEU IMOVEL ESTÁ APARECENDO RACHADURAS DEVIDO A UM EDIFICIO, DE TRÊS ANADARES, QUE FOI ERGUIDO AO LADO DO SEU, PEDE UMA VISTÓRIA E URGÊNCIA NO ATENDIMENTO.;PLANICIE;AFOGADOS;AFOGADOS;RUA SANTO CRISTO, N°482;PRIMEIRA RUA DA VILA SÃO MIGUELNA RUA DA PADARIA JUREMAR;5;5-SUDOESTE;5.1;Não;completo;ATENDIMENTO;;Vistoria
2015;05-maio;8014138315;2015-05-16;19:49;a usuaria informa que o vizinho construiu um muro de forma irregular e uma parte desse muro esta caindo para dentro de sua residencia causando perigo em sua casa.favor verificar com urgencia.;PLANICIE;AFOGADOS;AFOGADOS;rua doutor carlos alberto de menezes;no lado esquerda da maternidade bandeira pinto.;5;5-SUDOESTE;5.1;Sim;completo;ATENDIMENTO;;Vistoria
2015;05-maio;8014193415;2015-05-18;11:35;USUÁRIA SOLICITA VISTORIA EM SUA RESIDENCIA, POIS SEU VIZINHO ESTA CONSTRUINDO DE ALVENARIA QUE DESABOU MAS O MESMO CONTINUOU CONSTRUINDO. A MESMA QUER VISTORIA EM SUA CASA, POIS ESTA COM MEDO QUE ESTEJA COM DANIFICAÇÕES.;PLANICIE;AFOGADOS;AFOGADOS;RUA DR CARLOS ALBERTO DE MENEZES, N°119;RUA AO LADO ESQUERDO DA MATERNIDADE BANDEIRA FILHO.;5;5-SUDOESTE;5.1;Não;completo;ATENDIMENTO;;Vistoria
2015;04-abril;8010494015;2015-04-08;09:07;usuario deseja uma vistoria pois sua janela esta cedendo e com rachaduras,favor verificar.;PLANICIE;AFOGADOS;AFOGADOS;alfredo marrocos nº155;proximo ao hotel lemon.;5;5-SUDOESTE;5.1;Não;completo;ATENDIMENTO;;Vistoria
2015;03-marco;8009016015;2015-03-24;08:54;USUÁRIA SOLICITA VISTORIA EM SUA RESIDENCIA POIS EM SUA CASA ESTA TENDO INFILTRAÇÕES, A QUAL A CASA DE BAIXO ESTA COM OS TIJOLOS CAINDO. URGENTE.;PLANICIE;AFOGADOS;AFOGADOS;RUA ERNESTO CAVALCANTE, N°704;PRÓXIMO AO LAVA A JATO DE JUNIOR.;5;5-SUDOESTE;5.1;Não;completo;ATENDIMENTO;;Vistoria
2015;03-marco;8009029515;2015-03-24;09:09;USUÁRIA SOLICITA VISTORIA EM SUA RESIDENCIA, POIS A MESMA SE ENCONTRA ALGUMAS RACHADURAS NA SALA E NA COZINHA. CASA DE PRIMEIRO ANDAR.;PLANICIE;AFOGADOS;AFOGADOS;RUA BEZERRA DA PALMA, N°03;RUA FICA PERPENDICULAR A RUA VINTE E UM DE ABRIL, PRÓXIMO A PADARIA PAN DELICIA E AO CLUBE FERROVIÁRIO.;5;5-SUDOESTE;5.1;Não;completo;ATENDIMENTO;;Vistoria
2015;03-marco;8006949615;2015-03-09;07:51;USUARIA SOLICITA A VISTORIA POIS O PISO DA AREA DO CORREDOR ESTA ESQUENTANDO E SE ALASTRANDO.FAVOR VERIFICAR.;PLANICIE;AFOGADOS;AFOGADOS;RUA CORONEL OLIVEIRA Nº43;PROXIMO AO CLUB DO SARGENTO WOLFF.;5;5-SUDOESTE;5.1;Sim;completo;ATENDIMENTO;;Vistoria
2015;03-marco;8008924015;2015-03-23;16:05;vistoria pois seu imovel esta com rachaduras devido a uma construça de um predio.;PLANICIE;AFOGADOS;AFOGADOS;rua lavinia nº310;sentido centro bairro apos o banco do brasil a terceira rua a esquerda.a rua lavinia é a antiga sexta rua.;5;5-SUDOESTE;5.1;Não;completo;ATENDIMENTO;;Vistoria
2015;03-marco;8008951815;2015-03-23;19:37;VISTORIA EM UMA CASA QUE ESTA SENDO CONSTRUÍDA IRREGULARMENTE.;PLANICIE;AFOGADOS;AFOGADOS;RUA LAGEDAO Nº230;PROXIMO A ANTIGA CASA DAS CRIANÇAS CRAVO GAMA.;5;5-SUDOESTE;5.1;Sim;completo;ATENDIMENTO;;Vistoria
2015;02-fevereiro;8003594215;2015-02-10;06:18;USUARIO SOLICITA PRESENÇA DA DEFESA CIVIL NO LOCAL ONDE OCORREU UM INCENDIO. O MESMO DESEJA URGENCIA. SOLICITAÇAO PEDIDA PELO SARGENTO DE LIMA;PLANICIE;AFOGADOS;AFOGADOS;RUA AGRE, 150;NO MERCADO DE AFOGADOS E AO SUPERMERCADO TODO DIA;5;5-SUDOESTE;5.1;Sim;completo;ATENDIMENTO;;Vistoria
2015;01-janeiro;8000973215;2015-01-11;14:47;USUARIO INFORMA QUE ACABOU DE HAVER UM INCÊNDIO EM UMA RESIDENCIA. DIZ QUE O FOGO ATINGIU A COZINHA E UM QUARTO. PEDE URGENCIA.;PLANICIE;AFOGADOS;AFOGADOS;RUA CRUCILANDIA, Nº 199;AO LADO DO CLUBE VASSOURINHAS.;5;5-SUDOESTE;5.1;Sim;completo;ATENDIMENTO;;Vistoria
2015;01-janeiro;8000004015;2015-01-01;18:39;VISTORIA EM IMOVEL. MORADORA INFORMA QUE LAJE DO 1º ANDAR DE UM DUPLEX CAIU.PEDE URGENCIA POIS ESTÁ COM MEDO QUE ALGO MAIS GRAVE ACONTEÇA.;PLANA;AFOGADOS;AFOGADOS;RUA BETIM, Nº 23;PROXIMO AO CLUBE FERROVIARIO, ENTRAR RUA EM FRENTE, 2ª A DIREITA.;5;5-SUDOESTE;5.1;Sim;completo;ATENDIMENTO;;Vistoria
2014;10-outubro;8019146614;2014-10-30;14:38;USUÁRIO SOLICITA UMA VISTORIA EM UM IMÓVEL QUE VEIO A PEGAR FOGO PELA MANHA O MESMO INFORMA QUE NECESSITA DE UMA EQUIPE DA DEFESA CIVIL NO LOCAL COM URGÊNCIA.;PLANICIE;AFOGADOS;AFOGADOS;RUA ESTRADA DOS REMEDIOS;EM FRENTE AO SUPERMERCADO DO LAR NA ESTRADA DOS REMÉDIOS.;5;5-SUDOESTE;5.1;Não;completo;ATENDIMENTO;;Vistoria
2014;10-outubro;8018773714;2014-10-25;22:51;USUARIO SOLICITA VISTORIA EM IMOVEL,A EQUIPE DO CORPO DOS BOMBEIROS INFORMA QUE HOUVE INCÊNDIO NA RESIDENCIA ONDE A MESMA SE ENCONTRA EM RISCO DE DESABAMENTO E COM A ESTRUTURA PREJUDICADA DEVIDO AO FOGO.;PLANICIE;AFOGADOS;AFOGADOS;RUA ALBATROS, N°33;APOS O MOTEL EROS A PRIMEIRA A DIREITA;5;5-SUDOESTE;5.1;Sim;completo;ATENDIMENTO;;Vistoria
2014;09-setembro;8014505814;2014-09-02;14:22;USUARIA INF QUE OCORREU UM INCENDIO NA LOJA VIZINHA NO DIA 30/08 SABADO E FOI VERIFICADO HOJE QUE O MURO DA SUA LOJA ESTA COM RACHADURAS E ESTALANDO A MESMA INF QUE NESTE LOCAL É ONDE FICAM OS FUNCIONARIOS SOLICITA URGENCIA;PLANICIE;AFOGADOS;AFOGADOS;ESTRADA DOS REMEDIOS N°55;PROX A FEIRA DE AFOGADOS FICA NA LOJA ELECTRA BANCO ASTECA;5;5-SUDOESTE;5.1;Não;completo;ATENDIMENTO;;Vistoria
2014;09-setembro;8015034914;2014-09-08;13:08;USUÁRIA SOLICITA VISTORIA EM MURO QUE ESTÁ COM RISCO DE DESABAR E DANIFICAR CASAS VIZINHAS, COM RISCO AOS MORADORES.;PLANICIE;AFOGADOS;AFOGADOS;RUA BUGRE N. 62;PRÓX. A ENTRADA DO CARANGUEJO.;5;5-SUDOESTE;5.1;Não;completo;ATENDIMENTO;;Vistoria
2014;09-setembro;8014918014;2014-09-08;09:42;USUÁRIA SOLICITA VISTORIA EM CONSTRUÇÃO DA VIZINHA QUE ESTÁ COM RACHADURAS E RISCO AO MORADORES POIS ESTÁ DANIFICANDO TELHADOS, CONSTRUÇÃO IRREGULAR VISTORIAR COM URGÊNCIA.;PLANICIE;AFOGADOS;AFOGADOS;RUA PADRE TEÓFILO N. 180 CASA B;PRÓX. A TUPAN EM AFOGADOS.;5;5-SUDOESTE;5.1;Não;completo;ATENDIMENTO;;Vistoria
2014;09-setembro;8015765314;2014-09-12;17:33;teste;PLANICIE;AFOGADOS;AFOGADOS;teste;teste;5;5-SUDOESTE;5.1;Sim;completo;ATENDIMENTO;;Vistoria
2014;09-setembro;8015189214;2014-09-08;20:53;CASA DE PRIMEIRO ANDAR COM RACHADURAS E ENCONTRAM/SE TAMBÉM MINANDO ÁGUA. SOLICITA/SE URGENCIA;PLANICIE;AFOGADOS;AFOGADOS;RUA ANTONIO JUSTINO, 46;OUTRO: 86337896PRÓXIMO A ESTAÇÃO DE METRO IPIRANGA;5;5-SUDOESTE;5.1;Sim;completo;ATENDIMENTO;;Vistoria
2014;09-setembro;8015187014;2014-09-08;20:53;CASA DE PRIMEIRO ANDAR COM RACHADURAS E ENCONTRAM/SE TAMBÉM MINANDO ÁGUA. SOLICITA/SE URGENCIA;PLANICIE;AFOGADOS;AFOGADOS;RUA ANTONIO JUSTINO, 46;OUTRO: 86337896;5;5-SUDOESTE;5.1;Sim;completo;ATENDIMENTO;;Vistoria
2014;08-agosto;8014034514;2014-08-27;10:35;USUÁRIO SOLICITA A VISTORIA EM SEU IMÓVEL QUE ESTÁ COM O PISO ESQUENTANDO, O MESMO PEDE URGÊNCIA.;PLANICIE;AFOGADOS;AFOGADOS;RUA ESCRITOR ALEXANDRE NETURNO, Nº 361;POR TRÁS DA TUPAN. AO LADO DA ITAPEMIRIM. CELULAR DO SOLICITANTE (81)8609/1418.;5;5-SUDOESTE;5.1;Não;completo;ATENDIMENTO;;Vistoria
2014;08-agosto;8014288714;2014-08-30;05:05;CONTATO NO LOCAL É O SOLDADO MENESES (BOMBEIRO)SOLDADO TIMEU INFORMA QUE OUVE UM INCÊNDIO NO DEPOSITO DA ELETRO SHOPPING.;PLANICIE;AFOGADOS;AFOGADOS;RUA SÃO MIGUEL, 708;PROX. A ELEKTRA NA FEIRA DE AFOGADOS.;5;5-SUDOESTE;5.1;Sim;completo;ATENDIMENTO;;Vistoria
2014;06-junho;8009050614;2014-06-16;00:14;CONTATO: GLICIAINCENDIO EM UM PRIMEIRO ANDAR, SOLICITADO PELOS BOMBEIROS A CODECIR NO LOCAL.;GART;AFOGADOS;AFOGADOS;AV MINISTRO NELSON FERREIRA, 178;PROX A GARAGEM DA BORNOREMA;Não informada;Não informado;SUDOESTE - 1;Sim;completo;ATENDIMENTO;;
2014;08-agosto;8013516614;2014-08-19;09:24;USUÁRIA SOLICITA VISTORIA EM IMÓVEL INFORMA QUE ESTA COM RACHADURAS E INFILTRAÇÃO PEDE URGÊNCIA.;PLANICIE;AFOGADOS;AFOGADOS;RUA SANTOS CRISTO N 78 CASA A;PROX: A ANTIGA CASA DAS CRIANÇAS.;5;5-SUDOESTE;5.1;Não;completo;ATENDIMENTO;;Vistoria
2014;08-agosto;8013412614;2014-08-17;19:58;INCENDIO EM ESCOLA CAUSADO A PARTIR DE CURTO/CIRCUITO EM VENTILADOR;PLANICIE;AFOGADOS;AFOGADOS;RUA RUBIASSEIA, 147;ESCOLA MUNICIPAL VILA SÃO MIGUELTELEFONE: 85678435;5;5-SUDOESTE;5.1;Sim;completo;ATENDIMENTO;;Vistoria
2014;06-junho;8009042314;2014-06-14;17:58;VISTORIA NA RESIDENCIA (ARVORE TOMBOU SOBRE A CASA NO DIA DE HOJE) FAVOR DEFERIR A SITUAÇÃO COM BREVIDADE.;GART;AFOGADOS;AFOGADOS;RUA GENERAL GUIMARÃES COVA, 367;POR TRAS DO 14º BLOG / EXERCITO (PROX AO COLEGIO CARMELA DUTRA);Não informada;Não informado;SUDOESTE - 1;Sim;completo;ATENDIMENTO;;
2014;03-marco;8003059114;2014-03-04;11:25;usuaria deseja que seja avaliado o imovel pois esta com piso do quarto quente onde terceiros foi cavar e supostamente acredita que seja algo relacionado a vazamento de gás. demandante pede urgencia.;PLANICIE;AFOGADOS;afogaos;rua lidia quimarães nº 63;proximo a fabrica do café petinho sento san martins.;Não informada;Não informado;SUDOESTE - 1;Sim;completo;ATENDIMENTO;;
2014;03-marco;8004530014;2014-03-25;11:03;USUARIA INFORMA QUE NOS FUNDOS DO DUPLEX DELA HÁ UMA CONSTRUÇÃO DE UM PREDIO DE 4 ANDARES. EDIFICIO TORRE GÊMEAS. USUARIA SOLICITA UMA VISTORIA COM URGENCIA POIS A CONSTRUÇÃO CAUSOU MUITAS RACHADURAS NO PREDIO.;PLANICIE;AFOGADOS;VILA SAO MIGUEL;RUA CAMPO LARGO 355;A ENTRADA DA VILA FICA AO LADO DA IGREJA DA FÉ;Não informada;Não informado;SUDOESTE - 1;Não;completo;ATENDIMENTO;;
2014;03-marco;8003058514;2014-03-02;14:44;cabo do bombeiro Andrade Informa que o deposito da loja americanas pego fogo e que o edifício esta com a estrutura comprometida.Nº 8186703527;PLANICIE;AFOGADOS;AFOGADOS;RUA ONZE DE JUNHO,  53;PROX A LOJA CATAN ENFRENTE A FARMÁCIA PREÇO CERTO, POR TRAS DA LOJAS AMERICANAS;Não informada;Não informado;SUDOESTE - 1;Sim;completo;ATENDIMENTO;;
2014;03-marco;8003670214;2014-03-13;17:27;USUARIA INFORMA QUE HOUVE UMA EXPLOSAO POR CAUSA DO  GERADOR  DA LOJA AMERICANA, A DEFESA CIVIL FOI NO LOCAL, E DISSE NAO COLOCASSE MAIS GERADOR. MAIS A USUARIA INFORMA QUE ELES COMPROU UM NOVO GERADOR A MAIOR.  UMA VISTORIA NO LOCAL O MAIS RAPIDO POSSIVEL ANTES QUE ACONTEÇA OUTRA EXPLOSAO.;PLANICIE;AFOGADOS;AFOGADOS;RUA ONZE DE JUNHO  N°54;ENTRE EM FRENTE A FARMACIA PREÇO CERTO;Não informada;Não informado;SUDOESTE - 1;Sim;completo;ATENDIMENTO;;
2014;02-fevereiro;8001381314;2014-02-04;10:09;/USUARIO SOLICITA VISTORIA EM CASA QUE ESTA COM RISCO DE DESABAMENTO. A MESMA INF QUE ESTA COM ESTALOS E MUITAS RACHADURAS E PEDE URGENCIA.;PLANICIE;AFOGADOS;AFOGADO;RUA BEZERRA DA PALMA, 22 B;PROX A IGREJA ADVENTISTA DO SETIMO DIA E PROX AO GALPAO DE FRUTAS E VERDURAS;Não informada;Não informado;SUDOESTE - 1;Não;completo;ATENDIMENTO;;
2014;01-janeiro;8000193914;2014-01-08;09:58;pede vistoria em imovel, pois arvore da casa do vizinho,( uma mangueira) esta com raízes expostas e rachando piso da casa da moradora. pede que entrem em contato com a mesma para combinar vistoria, pois casa no momento esta vazia.;PLANICIE;AFOGADOS;vila sao miguel;rua lavinia, 34a;antiga rua sexta. prox da igreja da fe, igreja evangelica.;Não informada;Não informado;SUDOESTE - 1;Não;completo;ATENDIMENTO;;
2014;01-janeiro;8000020714;2014-01-03;15:38;VISTORIA EM CASA. MORADORA INFORMA QUE HOUVE UMA TREMOR EM SUA RESIDENCIA, ONDE APOS APARECERAM VARIAS RACHADURAS NAS PAREDES E O CHAO LEVANTOU. PEDE UMA VISTORIA COM URGENCIA.;PLANICIE;AFOGADOS;AFOGADOS;RUA GARDENIA, Nº 260;NA ENTRADA DA VILA SAO MIGUEL. FINAL DA RUA. PROXIMO A IGREJA DA FÉ.;Não informada;Não informado;SUDOESTE - 1;Não;completo;ATENDIMENTO;;
2013;12-dezembro;8018314413;2013-12-09;15:17;MUNÍCIPE DENUNCIA CONSTRUCAO IRREGULAR DE UM ANTIGO DUPLEX, QUE FOI EXPANDIDO PARA UM PREDIO DE 04 ANDARES E 04 APTOS (16 AO TODO) COMPROMETENDO O SOLO E PROVOCANDO ABATIMENTO NO ENTORNO. SOLICITAMOS AS DEVIDAS PROVIDENCIAS EM REGIME DE URGENCIA, A FIM DE DEFERIR ESTA OCORRENCIA.;GART;AFOGADOS;AFOGADOS;RUA LAVINIA, 316;BANCO DO BRASIL / AFOGADOS / IGREJA DA SÉ;Não informada;Não informado;SUDOESTE - 1;Não;completo;ATENDIMENTO;;
2013;12-dezembro;8018564013;2013-12-18;14:06;trata/se de construçao inrregular onde o morador construiu um predio de 4 andares sem autorizaçao em um area de mangue onde o usuario inf que depois das obras começaram a aparecer rachaduras nas residencias do local soliicta uma vistoria com urgencia;GART;AFOGADOS;AFOGADOS;rua lavinha n°316;na vila sao miguel apos o banco do brasil na esquina da igreja da sé procurar a antiga rua 6;Não informada;Não informado;SUDOESTE - 1;Não;completo;ATENDIMENTO;;
2013;12-dezembro;8018470613;2013-12-14;07:56;USUARIO SOLICITA VISTORIA EM SUA RESIDENCIA POIS INFORMA QUE SE ENCONTRA COM RISCO DE DESABAMENTO DEVIDO A CONSTRUÇÃO DE UMA CHURRASCARIA AO LADO DE SUA CASA.;PLANICIE;AFOGADOS;AFOGADOS;ESTRADA DOS REMEDIOS 1971;AO LADO DA HC PNEUS NO FINAL DA ESTRADA DOS REMEDIOS.;Não informada;Não informado;SUDOESTE - 1;Sim;completo;ATENDIMENTO;;
2013;11-novembro;8017831513;2013-11-25;09:58;VISTORIA EM DUPLEX QUE ESTA COM RISCO DEVIDO AS RACHADURAS. USUARIA PEDE URGENCIA.  A MESMA PEDE QUE ENTREM EM CONTATO ANTES A VISTORIA POIS ELE DESEJA ESTA PRESENTE.;PLANICIE;AFOGADOS;AFOGADOS;Rua Olímpio Chacon,99;813447/2779..........  NA RUA DA IGREJA DA SÉ E A MONTE CARLOS;Não informada;Não informado;SUDOESTE - 1;Não;completo;ATENDIMENTO;;
2013;11-novembro;8017426313;2013-11-08;17:19;SOLICITANTE INFORMA QUE APARECERAM VARIAS RACHADURAS REPENTINAMENTE NA RESIDENCIA. PEDE VISTORIA COM URGENCIA.;PLANICIE;AFOGADOS;VILA SAO MIGUEL;RUA SANTA ROSA, Nº 314;PROXIMO A CRUZADA DE AÇÃO SOCIAL;Não informada;Não informado;SUDOESTE - 1;Sim;completo;ATENDIMENTO;;
