ano;mes;processo_numero;solicitacao_data;solicitacao_hora;solicitacao_descricao;solicitacao_regional;solicitacao_bairro;solicitacao_localidade;solicitacao_endereco;solicitacao_roteiro;rpa_codigo;rpa_nome;solicitacao_microrregiao;solicitacao_plantao;processo_situacao;processo_tipo;processo_origem;processo_solicitacao
2015;03-marco;8005802115;2015-03-03;11:34;USUÁRIO SOLICITA VISTORIA EM BARREIRA POIS INFORMA QUE O VIZINHO DE TRÁS ESTÁ CONSTRUINDO EM LOCAL IRREGULAR E DE RISCO, EM BARREIRA. ATENDER COM URGÊNCIA.;NOROESTE;ALTO JOSE BONIFACIO;CGO. DO EUCLIDES;RUA ALOANDIA  N. 135;NA RUA SERRALHARIA DO SENHOR JOSÉ (CONHECIDA COMO RUA DA TAPA).;3;3-NOROESTE;3.2;Não;execucao;ATENDIMENTO;;Vistoria
2015;03-marco;8008036815;2015-03-14;19:31;usuaria solicita de capinaçao na barreira;NOROESTE;ALTO JOSE BONIFACIO;ALTO JOSE BONIFACIO;Rua Capinzal;prox ao colegio caio pereira;3;3-NOROESTE;3.2;Sim;execucao;ATENDIMENTO;;Vistoria
2015;03-marco;8007342815;2015-03-10;09:42;USUÁRIA SOLICITA CAPINAÇÃO EM BARREIRA COM URGÊNCIA.;NOROESTE;ALTO JOSE BONIFACIO;ALTO JOSE BONIFACIO;RUA ARATUBA N,955;A TERCEIRA A CASA APOS A PADARIA PÃO VITOR.;3;3-NOROESTE;3.2;Não;execucao;ATENDIMENTO;;Vistoria
2015;02-fevereiro;8004931215;2015-02-24;13:48;MORADOR INFORMA QUE VIZINHO ESTÁ ESCAVANDO A BARREIRA PARA CONSTUIR UMA LAJE. POREM A BARREIRA E MUITO ENCHARCADA. PEDE VISTORIA COM URGENCIA.;NOROESTE;ALTO JOSE BONIFACIO;ALTO JOSE BONIFACIO;RUA BISMARQUE DE FREITAS, Nº 31;ANTES DO TERMINAL DE ONIBUS DO ALTO JOSE BONIFACIO.;3;3-NOROESTE;3.2;Não;execucao;ATENDIMENTO;;Vistoria
2015;02-fevereiro;8004221515;2015-02-18;10:15;/USUARIO SOLICITA COLOCAÇÃO DE  4 LONA EM BARREIRA COM RISCO DE DESLIZAMENTO. O MESMO PEDE URGENCIA;NOROESTE;ALTO JOSE BONIFACIO;CGO. DO EUCLIDES;RUA MARIBONDO, 7248;PROX AO SALAO MAE E FILHO;3;3-NOROESTE;3.2;Não;execucao;ATENDIMENTO;;Colocacao de Lonas Plasticas
2015;02-fevereiro;8002788815;2015-02-02;09:22;USUÁRIO SOLICITA A VISTORIA NA BARREIRA, POIS ESTÁ TENDO UM VAZAMENTO DE ÁGUA NA BARREIRA, O MESMO INFORMA QUE NÃO SABE SE É ÁGUA DE FOÇA, MAS QUE ALÉM DE ESTÁ CAUSANDO DANOS A BARREIRA.;NOROESTE;ALTO JOSE BONIFACIO;ALTO JOSE BONIFACIO;RUA MODELO, Nº 3615;NA ESCADARIA AO LADO DA CASA QUE TEM UM ESCUDO DO SPORT, PRÓXIMO A BARRACA DE NENÉM;3;3-NOROESTE;3.2;Não;execucao;ATENDIMENTO;;Vistoria
2015;02-fevereiro;8004593015;2015-02-20;19:13;USUÁRIO INFORMOU QUE O MURO DE ARRIMO DA SUA RESIDENCIA ESTÁ COM INFILTRAÇÃO, ATÉ O MOMENTO SEM DESLIZAMENTO, PORÉM JÁ FOI ABERTA UMA SOLICITAÇÃO DE VISTORIA ANTERIORMENTE (80007527069415), SEGUNDO O USUÁRIO, A EQUIPE JÁ FOI ATÉ LOCAL TRÊS VEZES, MAS ATÉ O MOMENTO NENHUMA PROVIDENCIA FOI TOMADA E A INFILTRAÇÃO ESTÁ AUMENTANDO.;NOROESTE;ALTO JOSE BONIFACIO;CGO. DO EUCLIDES;RUA ALUANDIA, NÚMERO 3209;PRÓXIMO AO TERMINAL DE ÔNIBUS DO CÓRREGO DO EUCLIDES.;3;3-NOROESTE;3.2;Sim;execucao;ATENDIMENTO;;Vistoria
2015;02-fevereiro;8003888615;2015-02-12;09:37;DESEJA COLOCAÇÃO DE LONA E CAPINAÇÃO.;NOROESTE;ALTO JOSE BONIFACIO;CGO. JOSE GRANDE;RUA BOM SOSSEGO;EM FRENTE A BARRIGUDA;3;3-NOROESTE;3.2;Não;execucao;ATENDIMENTO;;Colocacao de Lonas Plasticas
2015;01-janeiro;8002439315;2015-01-29;08:27;estão jogando água constantemente na barreira.;NOROESTE;ALTO JOSE BONIFACIO;ALTO JOSE BONIFACIO;rua corrego jose grande n 27;proximo ao terminal de onibus bomba do hemeterio;3;3-NOROESTE;3.2;Não;execucao;ATENDIMENTO;;Vistoria
2015;01-janeiro;8002102915;2015-01-24;20:33;USUÁRIO SOLICITA COLOCAÇÃO DE LONA PLASTICA, INFORMA QUE JÁ SOLICITOU NA PREFEITURA A CONSTRUÇÃO DO MURO DE ARRIMO MAS DEVIDO AS CHUVAS SOLICITA LONA POIS INFORMA QUE A BARREIRA ESTÁ SEM NENHUMA PROTEÇÃO.;NOROESTE;ALTO JOSE BONIFACIO;ALTO JOSE BONIFACIO;RUA CORREGO JOSE GRANDE, N°27;NO TERMINAL DE ÔNIBUS DA BOMBA DO HEMETERIO;3;3-NOROESTE;3.2;Sim;execucao;ATENDIMENTO;;Colocacao de Lonas Plasticas
2015;01-janeiro;8001288115;2015-01-14;12:15;A DEMANDANTE SOLICITA VISTORIA EM UMA BARREIRA QUE CAIU E DANIFICOU PARTE DO IMÓVEL.;NOROESTE;ALTO JOSE BONIFACIO;CGO. JOSE GRANDE;Rua Arcângelo;PROMIXO AO MERCADINHO BRASIL;3;3-NOROESTE;3.2;Não;execucao;ATENDIMENTO;;Vistoria
2015;01-janeiro;8001152215;2015-01-13;13:30;MORADORA INFORMA QUE UM CANO DA COMPESA ESTÁ ESTOURADO A MAIS DE 6 MESES, E MUITA AGUA ESCORRE PELO MEIO DA ESCADARIA. OCORRENDO MUITAS AVARIAS, INFILTRAÇÕES E RACHADURAS NA ESCADARIA. PEDE VISTORIA PARA IDENTIFICAR RISCOS.;NOROESTE;ALTO JOSE BONIFACIO;CGO. SAO DOMINGOS SAVIO;RUA AMERICA, 11;PROXIMO A IGREJA CATOLICA DE SÃO DOMINGOS, 1ª ESCADARIA.;3;3-NOROESTE;3.2;Não;execucao;ATENDIMENTO;;Vistoria
2015;01-janeiro;8001571515;2015-01-19;08:46;O DEMANDANTE SOLICITA LIMPEZA E CAPINAÇÃO NA BARREIRA E EM UMA CANALETA DE UM MURRO DE ARRIMO.;NOROESTE;ALTO JOSE BONIFACIO;ALTO DO BRASIL;RUA AUREA;PRÓXIMO AO CLUBE TEIMOSO.;3;3-NOROESTE;3.2;Não;execucao;ATENDIMENTO;;Vistoria
2015;01-janeiro;8000069415;2015-01-04;08:49;USUÁRIO INFORMA QUE A BARREIRA ESTÁ MINANDO E QUE ENCIMA DA BARREIRA EXISTE UMA CANALETA. RISCO AOS MORADORES.;NOROESTE;ALTO JOSE BONIFACIO;CGO. DO EUCLIDES;RUA ALOANDIA N. 3209;EM FRENTE A CAPELINHA DO TERMINAL DO CÓR. DO EUCLIDES.;3;3-NOROESTE;3.2;Sim;execucao;ATENDIMENTO;;Vistoria
2014;12-dezembro;8021484214;2014-12-09;11:03;USUÁRIO SOLICITA VISTORIA EM BARREIRA POIS VIZINHO DE CIMA ESTÁ REALIZANDO CONSTRUÇÃO IRREGULAR COM RISCO DE DESABAMENTO.;NOROESTE;ALTO JOSE BONIFACIO;CGO. DO EUCLIDES;RUA TOBATI N. 20;PRÓX. AO BAR DOS AMIGOS.;3;3-NOROESTE;3.2;Não;execucao;ATENDIMENTO;;Vistoria
2014;12-dezembro;8021086714;2014-12-02;09:24;/USUARIO SOLICITA VISTORIA EM BARREIRA POIS O MESMO FOI ORIENTADO PELA REGIONAL PARA SOLICITAR A PARCERIA.;NOROESTE;ALTO JOSE BONIFACIO;CGO. JOSE GRANDE;RUA PASSIRA, 25 A;NO TERMINAL DE ONIBUS DO BOMBA DO HEMETERIO PERTO DO BAR DE ITAMAR;3;3-NOROESTE;3.2;Não;execucao;ATENDIMENTO;;Vistoria
2014;11-novembro;8019924914;2014-11-12;12:40;USUÁRIA INFORMA QUE SEU VIZINHO ESTA CAVANDO A BARREIRA E CONSTRUINDO UMA PASSAGEM DE MOTO E ALGUMAS CASAS. URGENTE.;NOROESTE;ALTO JOSE BONIFACIO;ALTO JOSE BONIFACIO;5 TRV ALTO DO TIRO, N°55.;APÓS O TERMINAL DE ÔNIBUS DO ALTO JOSÉ BONIFÁCIO.;3;3-NOROESTE;3.2;Não;execucao;ATENDIMENTO;;Vistoria
2014;11-novembro;8019745714;2014-11-07;17:17;USUÁRIO QUE UMA VISTORIA EM SUA RESIDENCIA,O MESMO INFORMA QUE UMA CAIXA DE ÁGUA ESTA CRIANDO RISCO NA SUA RESIDENCIA,O MESMO PEDE URGÊNCIA NA SOLICITAÇÃO.;NOROESTE;ALTO JOSE BONIFACIO;ALTO JOSE BONIFACIO;RUA BARRA SECA N01;ÃO LADO DA CAIXA D´ÁGUA.;3;3-NOROESTE;3.2;Sim;execucao;ATENDIMENTO;;Vistoria
2014;11-novembro;8019490914;2014-11-05;13:38;MUNÍCIPE DENUNCIA QUE DONA DE TERRENO INTERDITADO PELA DEFESA CIVIL E QUE RECEBE AUXILIO MORADIA, ESTÁ MORANDO NOVAMENTE NA RESIDENCIA. PEDE VISTORIA.;NOROESTE;ALTO JOSE BONIFACIO;ALTO JOSE BONIFACIO;RUA VERMOND, Nº 764/B;APOS O LAVA/JATO AMARELINHO, 1ª RUA A DIREITA.;3;3-NOROESTE;3.2;Não;execucao;ATENDIMENTO;;Vistoria
2014;11-novembro;8019308614;2014-11-03;16:08;erradicaçao de uma arvore na barreira;NOROESTE;ALTO JOSE BONIFACIO;CGO. ANTONIO LEAO;segunda travessa do corrego antonio leao 08;subindo a escadaria antonio leao do lado esquerdo.;3;3-NOROESTE;3.2;Não;execucao;ATENDIMENTO;;Vistoria
2014;11-novembro;8020577714;2014-11-25;11:16;USUARIA SOLICITA VISTORIA POIS EXISTE RACHADURAS NA SALA,NO QUARTO E NA COZINHA.;NOROESTE;ALTO JOSE BONIFACIO;ALTO JOSE BONIFACIO;ARY PITER Nº83 A;PROXIMO DO TERMINAL DO BREJO E DO ARMAZEM UNIAO.;3;3-NOROESTE;3.2;Não;execucao;ATENDIMENTO;;Vistoria
2014;11-novembro;8020689014;2014-11-26;16:52;o usuario informa que na barreira da rua esta muito desgastada por com conta da erosao.favor verificar com urgencia.;NOROESTE;ALTO JOSE BONIFACIO;CGO. DO EUCLIDES;Rua Córrego do Euclides;prox a assembleia de deus.;3;3-NOROESTE;3.2;Sim;execucao;ATENDIMENTO;;Vistoria
2014;11-novembro;8019827314;2014-11-11;09:30;USUARIO SOLICITA CAPINAÇAO EM BARREIRA. A MESMA INF QUE O CAPIM ESTA MUITO GRANDE;NOROESTE;ALTO JOSE BONIFACIO;CGO. JOSE GRANDE;RUA CGO JOSE GRANDE, 482;NO TERMINAL DE ONIBUS DA BOMBA DO HEMETERIO;3;3-NOROESTE;3.2;Não;execucao;ATENDIMENTO;;Vistoria
2014;10-outubro;8019002414;2014-10-29;15:14;SOLICITA/SE VISTORIA EM TERRENO DE AUXILIO.;NOROESTE;ALTO JOSE BONIFACIO;CGO. JOSE GRANDE;SEGUNDA TRAVESSA CORREGO JOSE GRANDE, Nº 900C;PRÓXIMO AO TERMINAL DE ÔNIBUS DA BOMBA DO HEMITERIO.;3;3-NOROESTE;3.2;Não;execucao;ATENDIMENTO;;Vistoria
2014;10-outubro;8018314214;2014-10-20;11:36;A USUÁRIA INFORMA QUE SEU VIZINHO ESTA CONSTRUINDO UM MURO EM CIMA DE UMA BARREIRA DE TRÊS METRO DE ALTURA. PODENDO OCASIONAR ACIDENTE NO LOCAL........;NOROESTE;ALTO JOSE BONIFACIO;ALTO JOSE BONIFACIO;SEGUNDA TRAVESSA SÃO PEDRO Nº30;EM FRENTE S IGREJA ASSEMBLEIA DE DEUS ENTRANDO A ESQUERDA;3;3-NOROESTE;3.2;Não;execucao;ATENDIMENTO;;Vistoria
2014;10-outubro;8018308214;2014-10-20;10:54;USUÁRIA SOLICITA A VISTORIA NA BARREIRA, POIS ESTÁ TENDO VAZAMENTO NA MESMA PODENDO TRAZER RISCO DE DESLIZAMENTO.;NOROESTE;ALTO JOSE BONIFACIO;CGO. SAO DOMINGOS SAVIO;RUA SÃO DOMINGOS SAVIO, Nº 1500;NA ENTRADA DA CASAS PEREIRA, PRÓXIMO A SUBIDA DOS ÔNIBUS QUE DÃO ACESSO AO ALTO JOSÉ BONIFACIL.;3;3-NOROESTE;3.2;Não;execucao;ATENDIMENTO;;Vistoria
2014;10-outubro;8018282314;2014-10-20;08:03;USUÁRIO DENUNCIA A MORADORA VIZINHA QUE ESTÁ FAZENDO A BARREIRA DE MODO IRREGULAR. O MESMO PEDE UMA FISCALIZAÇÃO COM URGÊNCIA.;NOROESTE;ALTO JOSE BONIFACIO;ALTO DO BRASIL;TRAVESSA SÃO PEDRO, Nº 30;DE FRENTE A ASSEMBLÉIA DE DEUS DO ALTO DO BRASIL.;3;3-NOROESTE;3.2;Não;execucao;ATENDIMENTO;;Vistoria
2014;10-outubro;8017906314;2014-10-14;10:08;USUÁRIO RECLAMA DE RESIDENCIA COM MURO DANIFICADO CAUSANDO RISCO A BARREIRA, PEDE QUE SEJA REALIZADO VISTORIA COM BREVIDADE, SEM DESLIZAMENTO DE BARREIRA ATÉ O MOMENTO;NOROESTE;ALTO JOSE BONIFACIO;CGO. DO EUCLIDES;RUA AGARATUANA, 36 D;EM FRENTE A ASSEMBLEIA DE DEUS RUA AO LADO NO BECO;3;3-NOROESTE;3.2;Não;execucao;ATENDIMENTO;;Vistoria
2014;10-outubro;8017837114;2014-10-13;15:53;USUÁRIO SOLICITA COLOCAÇÃO DE LONA PLASTICA E CAPINAÇÃO DE BARREIRA, INFORMA QUE TEM UMA BARREIRA AO LADO DE SUA RESIDÊNCIA QUE NUNCA FOI COLOCADA LONA E TEM MUITO MATO NA BARREIRA, SOLICITA URGÊNCIA.;NOROESTE;ALTO JOSE BONIFACIO;CGO. DO EUCLIDES;RUA SANTA CATARINA, N°97;PROX. A ESCOLA MUNICIPAL CORREGO DO EUCLIDES;3;3-NOROESTE;3.2;Não;execucao;ATENDIMENTO;;Colocacao de Lonas Plasticas
2014;10-outubro;8017837114;2014-10-13;15:53;USUÁRIO SOLICITA COLOCAÇÃO DE LONA PLASTICA E CAPINAÇÃO DE BARREIRA, INFORMA QUE TEM UMA BARREIRA AO LADO DE SUA RESIDÊNCIA QUE NUNCA FOI COLOCADA LONA E TEM MUITO MATO NA BARREIRA, SOLICITA URGÊNCIA.;NOROESTE;ALTO JOSE BONIFACIO;CGO. DO EUCLIDES;RUA SANTA CATARINA, N°97;PROX. A ESCOLA MUNICIPAL CORREGO DO EUCLIDES;3;3-NOROESTE;3.2;Não;execucao;ATENDIMENTO;;Vistoria
2014;10-outubro;8017792814;2014-10-13;11:43;USUÁRIO SOLICITA CAPINAÇÃO EM BARREIRA QUE POSSUI MURO DE ARRIMO E TELA DE CONTENÇÃO, SOLICITA URGÊNCIA POIS A VEGETAÇÃO ESTÁ ALTA.;NOROESTE;ALTO JOSE BONIFACIO;CGO. DO EUCLIDES;AV. CÓR. DO EUCLIDES N. 1504;EM FRENTE AO SALÃO DE BELEZA MÃE E FILHO.;3;3-NOROESTE;3.2;Não;execucao;ATENDIMENTO;;Vistoria
2014;10-outubro;8017479814;2014-10-08;20:01;USUÁRIO INFORMA UM CANALETA QUE ESTA COM UMA RACHÃO , QUE ESTA FILTRANDO NO MURO. MURO QUE FICA POR TRÁS DA SEDE DO GRUPOS DE JOVEM DO CÓRREGO EUCLIDES.;NOROESTE;ALTO JOSE BONIFACIO;CGO. DO EUCLIDES;RUA   ANAJAS N°171;DEPOIS DO SALÃO DE BELEZA MAE E FILHO;3;3-NOROESTE;3.2;Sim;execucao;ATENDIMENTO;;Vistoria
2014;10-outubro;8017286514;2014-10-07;10:51;USUÁRIA SOLICITA VISTORIA EM SUA BARREIRA, POIS A MESMA ESTA FAZENDO UM VÃO DE CASAS EM SEU TERRENO, A QUAL VIZINHO ESTA INFORMANDO QUE A MESMA ESTA CAVANDO A BARREIRA. TAMBÉM A ÁGUA DA CANALETA DE SEU VIZINHO ESTA ESCORRENDO SOBRE A BARREIRA.;NOROESTE;ALTO JOSE BONIFACIO;ALTO JOSE BONIFACIO;TRV ABREU, N°08;PRÓXIMO A BARRACA DE DONA MARIA.;3;3-NOROESTE;3.2;Não;execucao;ATENDIMENTO;;Vistoria
2014;10-outubro;8017121614;2014-10-03;12:13;VISTORIA EM BARREIRA DEVIDO CONSTRUÇAO IRREGULAR. O MESMO INF QUE ESTAO CAVANDO A BARREIRA CAUSANDO RISCO DE QUEDA.;NOROESTE;ALTO JOSE BONIFACIO;ALTO JOSE BONIFACIO;RUA ALTO JOSE BONIFACIO, 640;3304/8609..............PROX A PRAÇA DO ALTO JOSE BONIFACIO;3;3-NOROESTE;3.2;Não;execucao;ATENDIMENTO;;Vistoria
2014;10-outubro;8017013914;2014-10-02;11:44;USUARIO INF QUE ESTA COM UM VAZAMENTO DE UMA CANALETA EM SUA RESIDENCIA CAUSANDO RISCO DE QUEDA PARA A BARREIRA E RESIDENCIA.;NOROESTE;ALTO JOSE BONIFACIO;ALTO JOSE BONIFACIO;RUA ALOANDIA, 135;PROX A ASSEMBLEIA DE DEUS E A IGREJA SANTA ANA.;3;3-NOROESTE;3.2;Não;execucao;ATENDIMENTO;;Vistoria
2014;09-setembro;8016698814;2014-09-26;11:58;USUÁRIO SOLICITA CAPINAÇÃO EM BARREIRA E COLOCAÇÃO DE LONA COM URGÊNCIA.;NOROESTE;ALTO JOSE BONIFACIO;CGO. DO EUCLIDES;RUA SANTA CATARINA  N. 97;PRÓX. AO COLÉGIO CÓR. DO EUCLIDES.;3;3-NOROESTE;3.2;Não;execucao;ATENDIMENTO;;Vistoria
2014;09-setembro;8016412714;2014-09-22;15:35;SOLICITA/SE CAPINAÇÃO EM BARREIRA, FAVOR VERIFICAR.;NOROESTE;ALTO JOSE BONIFACIO;ALTO JOSE BONIFACIO;RUA GUSTAVO BARROSO Nº 504;POR TRÁS DA CRECHE CRIANÇA FELIZ;3;3-NOROESTE;3.2;Não;execucao;ATENDIMENTO;;Vistoria
2014;09-setembro;8016829514;2014-09-30;11:20;USUARIA SOLICITA VISTORIA EM BARREIRA QUE ESTA COM RISCO DEVIDO A UMA CONSTRUÇAO IRREGULAR. A MESMA PEDE URGENCIA;NOROESTE;ALTO JOSE BONIFACIO;CGO. DO EUCLIDES;RUA CGO DO EUCLIDES, 1824;PROX AO ARMAZEM UNIAO DE CONSTRUÇAO;3;3-NOROESTE;3.2;Não;execucao;ATENDIMENTO;;Vistoria
2014;09-setembro;8016256514;2014-09-19;08:55;USUÁRIA SOLICITA RECOLOCAÇÃO DE LONA, DEVIDO A LONA ATUAL ESTA RASGADA.;NOROESTE;ALTO JOSE BONIFACIO;ALTO JOSE BONIFACIO;2 TRV  ANAJAS, N°220.;PRÓXIMO AO MERCADINHO DE PEQUENO, VINDO DE LINHA DO TIRO, ANTES DO CÓRREGO DO EUCLIDES.;3;3-NOROESTE;3.2;Não;execucao;ATENDIMENTO;;Colocacao de Lonas Plasticas
2014;09-setembro;8016256514;2014-09-19;08:55;USUÁRIA SOLICITA RECOLOCAÇÃO DE LONA, DEVIDO A LONA ATUAL ESTA RASGADA.;NOROESTE;ALTO JOSE BONIFACIO;ALTO JOSE BONIFACIO;2 TRV  ANAJAS, N°220.;PRÓXIMO AO MERCADINHO DE PEQUENO, VINDO DE LINHA DO TIRO, ANTES DO CÓRREGO DO EUCLIDES.;3;3-NOROESTE;3.2;Não;execucao;ATENDIMENTO;;Vistoria
2014;09-setembro;8016213414;2014-09-18;12:57;USUÁRIO INFORMA QUE O MORADOR ESTÁ CONSTRUINDO UM PRIMEIRO ANDAR EM TERRENO CONDENADO PELA CODECIR. PEDE ESSA FISCALIZAÇÃO COM URGÊNCIA.;NOROESTE;ALTO JOSE BONIFACIO;CGO. JOSE GRANDE;RUA ALBINO KROSS, Nº 42;PRÓXIMO AO TERMINAL DA BOMBA DO HEMETÉRIO.;3;3-NOROESTE;3.2;Não;execucao;ATENDIMENTO;;Vistoria
2014;09-setembro;8016181514;2014-09-18;10:11;DENUNCIANTE INFORMA QUE A DEFESA CIVIL DESOCUPOU UMA CASA, DEVIDO A MESMA ESTA CONDENADA, A QUAL MORADORES ESTÃO RECEBENDO O AUXILIO MORADIA, MAS VOLTARAM A RESIDIR NA CASA CONDENADA, A QUAL ESTÃO RECEBENDO O AUXILIO E MORANDO NA CASA CONDENADA A 10 ANOS. URGENTE.;NOROESTE;ALTO JOSE BONIFACIO;CGO. DO EUCLIDES;RUA   VERMOND, N°764 C;PRÓXIMO A O BAR DOS AMIGOS E O AMARELINHO.;3;3-NOROESTE;3.2;Não;execucao;ATENDIMENTO;;Vistoria
2014;09-setembro;8016053714;2014-09-16;15:18;SOLICITA CAPINAÇÃO DE BARREIRA E MURO DE ARRIMO.;NOROESTE;ALTO JOSE BONIFACIO;ALTO JOSE BONIFACIO;RUA GUSTAVO BARROSO, Nº 185;POR TRAS DA CRECHE CRIANÇA FELIZ.;3;3-NOROESTE;3.2;Não;execucao;ATENDIMENTO;;Vistoria
2014;09-setembro;8015805514;2014-09-14;13:26;MORADORA SOLICITA CAPINAÇÃO EM BARREIRA. PEDE URGENCIA.;NOROESTE;ALTO JOSE BONIFACIO;CGO. JOSE GRANDE;RUA NESTOR TAVARES, Nº 09;PROXIMO AO TERMINAL DO ÔNIBUS BOMBA DO HEMETÉRIO.;3;3-NOROESTE;3.2;Sim;execucao;ATENDIMENTO;;Vistoria
2014;09-setembro;8014299914;2014-09-01;07:40;DEMANDANTE DESEJA REPOSIÇÃO DE LONA COM BREVIDADE, POIS A QUE TEM NA BARREIRA ESTA RASGADA;NOROESTE;ALTO JOSE BONIFACIO;ALTO DO TIRO;RUA SANTANA,36;PRÓXIMO AO TERMINAL DO ÔNIBUS SEGUE EM FRENTE E BARRACA DO SENHOR BINO;3;3-NOROESTE;3.2;Sim;execucao;ATENDIMENTO;;Colocacao de Lonas Plasticas
2014;09-setembro;8014301314;2014-09-01;07:43;DEMANDANTE SOLICITA REPOSIÇÃO DE LONA COM BREVIDADE, POIS A QUE JA TEM ESTA RASGADA;NOROESTE;ALTO JOSE BONIFACIO;ALTO DA SERRINHA;RUA BISMARQUE DE FREITAS, Nº 125;PRÓXIMO A IGREJA ROMPENDO EM FÉ;3;3-NOROESTE;3.2;Sim;execucao;ATENDIMENTO;;Colocacao de Lonas Plasticas
2014;09-setembro;8014317714;2014-09-01;09:57;USUÁRIO PEDE REPOSIÇÃO DE LONA, POIS A QUE JÁ TEM NO LOCAL ESTA RASGADA,SEM DESLIZAMENTO.;NOROESTE;ALTO JOSE BONIFACIO;ALTO DA SAUDADE;RUA ALTO DA SAUDADE, Nº 1789;APOS A BARRACA DO SENHOR TOINHO.;3;3-NOROESTE;3.2;Não;execucao;ATENDIMENTO;;Colocacao de Lonas Plasticas
2014;09-setembro;8015603314;2014-09-11;16:02;SOLICITA REPOSIÇÃO DE LONA NA BARREIRA E A CAPINAÇÃO.;NOROESTE;ALTO JOSE BONIFACIO;ALTO JOSE BONIFACIO;2ª TRV SARGENTO ERALDO, Nº 10;APOS A ASSOCIAÇÃO DE MORADORES.;3;3-NOROESTE;3.2;Não;execucao;ATENDIMENTO;;Colocacao de Lonas Plasticas
2014;09-setembro;8015598014;2014-09-11;15:37;MORADOR INFORMA QUE TEM UM PÉ DE CARAMBORA DE MEDIO PORTE PROXIMO A LADEIRA QUE ESTÁ COM RISCO DE CAIR SOBRE A FIAÇÃO DO POSTE. PEDE VISTORIA E A POSSIVEL A ERRADICAÇÃO.;NOROESTE;ALTO JOSE BONIFACIO;ALTO JOSE BONIFACIO;RUA SARGENTO ERALDO, Nº 63;APOS ASSOCIAÇÃO DOS MORADORES.;3;3-NOROESTE;3.2;Não;execucao;ATENDIMENTO;;Vistoria
2014;09-setembro;8015552014;2014-09-11;10:15;/USUARIO SOLICITA  CAPINAÇÃO EM BARREIRA. A MESMA PEDE URGENCIA POIS O CAPIM ESTA MUITO GRANDE.;NOROESTE;ALTO JOSE BONIFACIO;CGO. JOSE GRANDE;RUA NESTOR TAVARES, 482;PROX AO TERMINAL DE ONIBUS BOMBA DO HEMETERIO.;3;3-NOROESTE;3.2;Não;execucao;ATENDIMENTO;;Vistoria
2014;09-setembro;8015534114;2014-09-11;08:50;/USUARIO SOLICITA COLOCAÇÃO DE LONA EM BARREIRA COM RISCO. O MESMO PEDE URGENCIA;NOROESTE;ALTO JOSE BONIFACIO;ALTO JOSE BONIFACIO;RUA ARAUNA, Nº 49;DEPOIS DA BARBEARIA DE ALEXANDRE;3;3-NOROESTE;3.2;Não;execucao;ATENDIMENTO;;Colocacao de Lonas Plasticas
2014;09-setembro;8015482114;2014-09-10;14:07;MORADOR SOLICITA A VISTORIA DA SUA BARREIRA QUE JÁ HOUVE DESLIZAMENTO. E PEDE A COLOCAÇÃO DA LONA PLASTICA.;NOROESTE;ALTO JOSE BONIFACIO;ALTO JOSE BONIFACIO;RUA AMBAR, Nº 48;PROXIMO A PRACINHA DA 2ª SUBIDA DO ALTO JOSE BONIFACIO.;3;3-NOROESTE;3.2;Não;execucao;ATENDIMENTO;;Colocacao de Lonas Plasticas
2014;09-setembro;8015482114;2014-09-10;14:07;MORADOR SOLICITA A VISTORIA DA SUA BARREIRA QUE JÁ HOUVE DESLIZAMENTO. E PEDE A COLOCAÇÃO DA LONA PLASTICA.;NOROESTE;ALTO JOSE BONIFACIO;ALTO JOSE BONIFACIO;RUA AMBAR, Nº 48;PROXIMO A PRACINHA DA 2ª SUBIDA DO ALTO JOSE BONIFACIO.;3;3-NOROESTE;3.2;Não;execucao;ATENDIMENTO;;Vistoria
2014;09-setembro;8015447114;2014-09-10;09:56;USUÁRIA SOLICITA COLOCAÇÃO DE LONA .;NOROESTE;ALTO JOSE BONIFACIO;ALTO JOSE BONIFACIO;RUA ALTO JOSE BONIFACIO N 204;EM FRENTE APO ARNAZEM UNIÃO.;3;3-NOROESTE;3.2;Não;execucao;ATENDIMENTO;;Colocacao de Lonas Plasticas
2014;09-setembro;8015345414;2014-09-09;13:01;USUÁRIO SOLICITA CAPINAÇÃO EM BARREIRA, INFORMA QUE ESTA COM INFILTRAÇÃO POR BAIXO DA LONA.;NOROESTE;ALTO JOSE BONIFACIO;ALTO JOSE BONIFACIO;RUA MARIBONDO N 1355;USUÁRIO SOLICITA CAPIANAÇÃO EM BARREIRA.;3;3-NOROESTE;3.2;Não;execucao;ATENDIMENTO;;Vistoria
2014;09-setembro;8015295714;2014-09-09;10:40;/USUARIO SOLICITA  COLOCAÇÃO DE LONA EM BARREIRA COM RISCO DE DESLIZAMENTO. O MESMO PEDE URGENCIA;NOROESTE;ALTO JOSE BONIFACIO;ALTO JOSE BONIFACIO;RUA VISCONDE DE SA BANDEIRA.384;POR TRAS DA CRECHE;3;3-NOROESTE;3.2;Não;execucao;ATENDIMENTO;;Colocacao de Lonas Plasticas
2014;09-setembro;8015183414;2014-09-08;20:32;USUARIO INFORMA QUE CAIU OS GRANDES PORTES EM CIMA DE 2 CASAS . PEDE URGENCIA DE UMA VISTORIA;NOROESTE;ALTO JOSE BONIFACIO;CGO. DO EUCLIDES;RUA SAO  DOMINGOS SAVIO N°512 E 520;NA SUBIDA  DO ALTO JOSE BONIFACIO, UMA RUA PARA DIREITA DE ESQUINA TEM UMA LOJA CASA PEREIRA;3;3-NOROESTE;3.2;Sim;execucao;ATENDIMENTO;;Vistoria
2014;09-setembro;8015181114;2014-09-08;20:30;USUARIO INFORMA QUE CAIU OS GRANDES PORTES EM CIMA DE 2 CASAS . PEDE URGENCIA DE UMA VISTORIA;NOROESTE;ALTO JOSE BONIFACIO;CGO. DO EUCLIDES;RUA SAO  DOMINGOS SAVIO N°512 E 520;NA SUBIDA  DO ALTO JOSE BONIFACIO, UMA RUA PARA DIREITA DE ESQUINA TEM UMA LOJA CASA PEREIRA;3;3-NOROESTE;3.2;Sim;execucao;ATENDIMENTO;;Vistoria
2014;09-setembro;8015176814;2014-09-08;20:00;USUARIA INFORMA QUE A BARREIRA ESTA DESLIZANDO NECESSITA DE UMA LONA NO LOCAL;NOROESTE;ALTO JOSE BONIFACIO;ALTO JOSE BONIFACIO;RUA   BISMARCK DE FREITAS N°22;EM FRENTE A IGREJA ROMPENDO EM FE;3;3-NOROESTE;3.2;Sim;execucao;ATENDIMENTO;;Colocacao de Lonas Plasticas
2014;09-setembro;8015143214;2014-09-08;16:54;SOLICITA A REPOSIÇÃO DE LONA PLASTICA.;NOROESTE;ALTO JOSE BONIFACIO;ALTO DO TIRO;RUA ARAUNA, Nº 49;APOS O TERMINAL DO ONIBUS ALTO JOSE BONIFACIO.;3;3-NOROESTE;3.2;Não;execucao;ATENDIMENTO;;Colocacao de Lonas Plasticas
2014;09-setembro;8015116514;2014-09-08;15:45;QUEDA DE BARREIRA ,USUARIO INF QUE BARREIRA ESTA A 1M DA CASA SOLIICTA URGENCIA;NOROESTE;ALTO JOSE BONIFACIO;ALTO JOSE BONIFACIO;RUA AMBAR N°48;SUBIDA DA LADEIRA DO ALTO JOSE BONIFACIO A 1°ENTRADA A DIREITA PROX AO PÉ DE CASTANHOLA;3;3-NOROESTE;3.2;Não;execucao;ATENDIMENTO;;Vistoria
2014;09-setembro;8015085214;2014-09-08;14:17;RECOLOCAÇAO DE LONA;NOROESTE;ALTO JOSE BONIFACIO;CGO. SAO DOMINGOS SAVIO;CORREGO SAO DOMINGOS SAVIO N°182;PROX DA BARRACA DE MARCIO;3;3-NOROESTE;3.2;Não;execucao;ATENDIMENTO;;Colocacao de Lonas Plasticas
2014;09-setembro;8014379214;2014-09-01;14:10;SOLICITA A REPOSIÇÃO DE LONA PLASTICA NA BARREIRA QUE ESTÁ RASGADA.;NOROESTE;ALTO JOSE BONIFACIO;ALTO JOSE BONIFACIO;RUA ARY PETER, Nº 1634;PROXIMO A CRECHE CANN.;3;3-NOROESTE;3.2;Não;execucao;ATENDIMENTO;;Colocacao de Lonas Plasticas
2014;09-setembro;8015022014;2014-09-08;12:25;USUÁRIO SOLICITA A COLOCAÇÃO DA LONA, POIS A QUE ESTAVA NO LOCAL SE RASGOU.;NOROESTE;ALTO JOSE BONIFACIO;CGO. JOSE GRANDE;RUA TACIRA, Nº25 A;PRÓXIMO AO TERMINAL DE ÔNIBUS DO CÓRREGO JOSÉ GRANDE, RUA DE ESQUINA COM O BAR DE ITAMAR.;3;3-NOROESTE;3.2;Não;execucao;ATENDIMENTO;;Colocacao de Lonas Plasticas
2014;09-setembro;8014819214;2014-09-06;14:08;USUARIO INFORMA QUE ESTÁ SENDO CONSTRUÍDO UM IMÓVEL EM CIMA DE UMA BARREIRA E TEME DE OCORRER RISCO E SOLICITA VISTORIA PARA QUE SEJA VERIFICADO .;NOROESTE;ALTO JOSE BONIFACIO;CGO. SAO DOMINGOS SAVIO;RUA LAMBARI;NA ENTRADA DO ARMAZÉM OLIVEIRA APOS A BARRACA DE SR. CHINA PRIMEIRA ESCADARIA A DIREITA, SEGUNDA CASA AO LADO ESQUERDO DA ESCADARIA;3;3-NOROESTE;3.2;Sim;execucao;ATENDIMENTO;;Vistoria
2014;09-setembro;8014809714;2014-09-06;09:25;/USUARIO SOLICITA VISTORIA EM BARREIRA POIS ACABOU DE DESLIZAR CAUSANDO RISCO AOS MORADORES. O MESMO PEDE URGENCIA.;NOROESTE;ALTO JOSE BONIFACIO;ALTO DA SERRINHA;RUA HDROLANDIA, 36;EM FRENTE A IGREJA ROMPENDO EM FE;3;3-NOROESTE;3.2;Sim;execucao;ATENDIMENTO;;Vistoria
2014;07-julho;8010121014;2014-07-01;10:38;USUÁRIA SOLICITA VISTORIA EM BARREIRA QUEM TEM RISCO DE DESABAMENTO DEVIDO CONSTRUÇÃO INRREGULAR NA PARTE ALTA DA BARREIRA. ATENDER COM URGÊNCIA.;NOROESTE;ALTO JOSE BONIFACIO;CÓR. DO EUCLIDES / BOQUEIRÃO;1 TRAV ARY PETER N.  98;APÓS A CRECHE CAMM E PRÓX. AO TERMINAL DO BREJO E LINHA DO TIRO.;Não informada;Não informado;NOROESTE - 2;Não;execucao;ATENDIMENTO;;
2014;07-julho;8010115014;2014-07-01;10:29;USUÁRIA SOLICITA VISTORIA EM BARREIRA E MURO DE ARRIMO, COLOCAÇÃO DE LONA, POIS O MURO DE ARRIMO QUE ESTÁ COM RISCO DE DESABAR. ATENDER COM URGÊNCIA.;NOROESTE;ALTO JOSE BONIFACIO;CÓR. DO EUCLIDES / BOQUEIRÃO;RUA ARY PETER N.  37;APÓS A CRECHE CAMM E PRÓX. AO TERMINAL DO BREJO E LINHA DO TIRO.;Não informada;Não informado;NOROESTE - 2;Não;execucao;ATENDIMENTO;;
2014;07-julho;8010117314;2014-07-01;10:31;USUÁRIA SOLICITA VISTORIA EM BARREIRA E MURO DE ARRIMO, COLOCAÇÃO DE LONA, POIS O MURO DE ARRIMO QUE ESTÁ COM RISCO DE DESABAR. ATENDER COM URGÊNCIA.;NOROESTE;ALTO JOSE BONIFACIO;CÓR. DO EUCLIDES / BOQUEIRÃO;RUA ARY PETER N. 38;APÓS A CRECHE CAMM E PRÓX. AO TERMINAL DO BREJO E LINHA DO TIRO.;Não informada;Não informado;NOROESTE - 2;Não;execucao;ATENDIMENTO;;
2014;07-julho;8010119614;2014-07-01;10:33;USUÁRIA SOLICITA VISTORIA EM BARREIRA E MURO DE ARRIMO, COLOCAÇÃO DE LONA, POIS O MURO DE ARRIMO QUE ESTÁ COM RISCO DE DESABAR. ATENDER COM URGÊNCIA.;NOROESTE;ALTO JOSE BONIFACIO;CÓR. DO EUCLIDES / BOQUEIRÃO;RUA ARY PETER N. 78;APÓS A CRECHE CAMM E PRÓX. AO TERMINAL DO BREJO E LINHA DO TIRO.;Não informada;Não informado;NOROESTE - 2;Não;execucao;ATENDIMENTO;;
2014;06-junho;8009783314;2014-06-27;07:03;USUÁRIO SOLICITA VISTORIA EM BARREIRA POIS O MORADOR DA CASA DE CIMA OBSTRUIU A PASSAGEM DA ÁGUA REFERENTE A CANALETA E COM ISSO A ÁGUA ESTÁ INFILTRANDO NA BARREIRA E COM GRANDE RISCO DE DESLIZAMENTO POR SOBRE A CASA QUE FICA NA PARTE DE BAIXO. ATENDER COM URGÊNCIA.;NOROESTE;ALTO JOSE BONIFACIO;SÃO DOMINGOS SÁVIO;RUA MODELO N. 42;PRÓX. A ASSOCIAÇÃO DOS MORADORES.;Não informada;Não informado;NOROESTE - 2;Sim;execucao;ATENDIMENTO;;
2014;06-junho;8009782714;2014-06-27;06:37;USUÁRIO SOLICITA VISTORIA E COLOCAÇÃO DE LONA DEVIDO AS ÚLTIMAS CHUVAS CORRE RISCO DE DESABAR. ATENDER COM URGÊNCIA.;NOROESTE;ALTO JOSE BONIFACIO;ALTO DO BRASIL;RUA ESPLANADA N. 255;APÓS A ASSEMBLÉIA DE DEUS DO ALTO DO BRASIL.;Não informada;Não informado;NOROESTE - 2;Sim;execucao;ATENDIMENTO;;
2014;06-junho;8009742514;2014-06-26;18:17;O USUARIO SOLICITA A REPOSIÇAO DE LONA EM BARREIRA E INFORMA QUE JA HOUVE UM DESLIZAMENTO.FAVOR VERIFICAR COM URGENCIA.;NOROESTE;ALTO JOSE BONIFACIO;ALTO JOSE BONIFACIO;RUA NOBREGA,N°240;PROX DA FEIRA DA RODINHO.PROX A OFICINA DE DARIO.ACESSO PELA RUA SAO DOMINGOS SAVIO.;Não informada;Não informado;NOROESTE - 2;Sim;execucao;ATENDIMENTO;;
